id,content
1,"Investasi saham adalah instrumen keuangan yang menarik di mana investor membeli sebagian kecil kepemilikan di sebuah perusahaan yang diperdagangkan secara publik. Dengan membeli saham, investor menjadi pemegang saham perusahaan dan berhak atas keuntungan perusahaan, seperti dividen dan kenaikan nilai saham."
2,"Pasar saham adalah tempat di mana saham diperdagangkan. Saham diperdagangkan di bursa saham, seperti Bursa Efek Indonesia (BEI). Harga saham di pasar saham ditentukan oleh permintaan dan penawaran."
3,"Keuntungan investasi saham dapat diperoleh dari dua cara utama: dividen dan capital gain. Dividen adalah sebagian keuntungan perusahaan yang dibagikan kepada pemegang saham. Capital gain adalah keuntungan yang diperoleh dari kenaikan nilai saham."
4,"Risiko investasi saham adalah kemungkinan kerugian yang dapat dialami oleh investor. Risiko investasi saham dapat disebabkan oleh berbagai faktor, seperti fluktuasi harga saham, kondisi ekonomi, dan kinerja perusahaan."
5,"Sebelum berinvestasi saham, penting untuk memahami dengan baik risiko dan keuntungannya. Investor juga harus melakukan riset yang menyeluruh terhadap perusahaan yang ingin diinvestasikan."
6,"Ada beberapa cara untuk belajar tentang investasi saham. Investor dapat membaca buku, artikel, atau blog tentang investasi saham. Investor juga dapat mengikuti seminar atau webinar tentang investasi saham."
7,"Investasi saham adalah cara yang baik untuk membangun kekayaan dalam jangka panjang. Namun, penting untuk diingat bahwa investasi saham memiliki risiko. Investor harus siap untuk menanggung risiko dan tidak berinvestasi lebih dari yang mereka mampu untuk kehilangan."
8,"Jika Anda tertarik untuk berinvestasi saham, ada beberapa langkah yang dapat Anda ikuti:
- Buka rekening sekuritas di perusahaan sekuritas yang terdaftar di Otoritas Jasa Keuangan (OJK).
- Setorkan dana ke rekening sekuritas Anda.
- Pilih saham yang ingin Anda investasikan.
- Beli saham melalui perusahaan sekuritas Anda."
9,"Investasi saham dapat menjadi cara yang menguntungkan untuk membangun kekayaan. Namun, penting untuk berinvestasi dengan bijak dan memahami risiko yang terlibat."
10,"Jika Anda masih belum yakin tentang investasi saham, Anda dapat berkonsultasi dengan perencana keuangan atau penasihat investasi."
