id,context,question,answer,answer_start
392,"Hutang jangka panjang adalah utang yang jatuh tempo lebih dari satu tahun dari tanggal laporan keuangan. Contoh hutang jangka panjang termasuk pinjaman hipotek, obligasi, dan pinjaman bank jangka panjang. Mengelola hutang jangka panjang melibatkan memastikan bahwa pembayaran bunga dan pokok dapat dipenuhi sesuai jadwal. Hutang jangka panjang sering digunakan untuk membiayai investasi besar, seperti pembelian properti atau peralatan. Pengelolaan yang baik dapat membantu menjaga kesehatan keuangan dan arus kas yang stabil.","Apa itu hutang jangka panjang dan bagaimana cara mengelolanya?","Hutang jangka panjang adalah utang yang jatuh tempo lebih dari satu tahun dari tanggal laporan keuangan",0
393,"Laporan laba rugi adalah salah satu laporan keuangan utama yang menunjukkan pendapatan, biaya, dan laba bersih perusahaan selama periode tertentu. Laporan ini membantu pemilik bisnis dan investor memahami kinerja keuangan perusahaan. Dengan menganalisis laporan laba rugi, seseorang dapat mengidentifikasi sumber pendapatan utama, mengukur efisiensi operasional, dan menilai profitabilitas. Laporan laba rugi penting untuk pengambilan keputusan bisnis dan perencanaan strategis.","Apa yang ditunjukkan oleh laporan laba rugi dan mengapa itu penting?","Laporan laba rugi adalah salah satu laporan keuangan utama yang menunjukkan pendapatan, biaya, dan laba bersih perusahaan selama periode tertentu",0
394,"Kebijakan dividen adalah keputusan perusahaan tentang berapa banyak laba yang akan dibayarkan kepada pemegang saham dalam bentuk dividen versus berapa banyak yang akan diinvestasikan kembali ke dalam perusahaan. Kebijakan dividen dapat bervariasi, dengan beberapa perusahaan memilih untuk membayar dividen yang konsisten dan stabil, sementara yang lain mungkin memilih untuk tidak membayar dividen sama sekali dan menginvestasikan kembali semua laba. Kebijakan dividen penting karena dapat mempengaruhi harga saham dan menarik berbagai jenis investor.","Apa itu kebijakan dividen dan bagaimana itu mempengaruhi investor?","Kebijakan dividen adalah keputusan perusahaan tentang berapa banyak laba yang akan dibayarkan kepada pemegang saham dalam bentuk dividen",0
395,"Pasar saham adalah tempat di mana saham perusahaan diperdagangkan antara investor. Pasar saham menyediakan platform untuk membeli dan menjual saham, memungkinkan perusahaan untuk mengumpulkan modal dan investor untuk berpartisipasi dalam pertumbuhan perusahaan. Pasar saham juga mencerminkan sentimen investor dan kondisi ekonomi secara keseluruhan. Berinvestasi di pasar saham memerlukan pemahaman yang baik tentang analisis saham dan manajemen risiko, karena harga saham dapat sangat berfluktuasi.","Apa itu pasar saham dan apa perannya dalam perekonomian?","Pasar saham adalah tempat di mana saham perusahaan diperdagangkan antara investor",0
396,"Likuiditas adalah kemampuan untuk mengonversi aset menjadi uang tunai dengan cepat tanpa kehilangan nilai signifikan. Likuiditas penting bagi individu dan bisnis untuk memenuhi kewajiban keuangan yang mendesak. Aset likuid termasuk uang tunai, rekening bank, dan sekuritas yang mudah dijual seperti saham. Kurangnya likuiditas dapat menyebabkan kesulitan keuangan dan ketidakmampuan untuk membayar kewajiban tepat waktu. Mengelola likuiditas melibatkan menjaga keseimbangan antara aset likuid dan aset jangka panjang.","Apa yang dimaksud dengan likuiditas dan mengapa itu penting?","Likuiditas adalah kemampuan untuk mengonversi aset menjadi uang tunai dengan cepat tanpa kehilangan nilai signifikan",0
397,"Inflasi adalah kenaikan umum dalam harga barang dan jasa dari waktu ke waktu, yang mengurangi daya beli uang. Inflasi dapat disebabkan oleh berbagai faktor, termasuk peningkatan permintaan, biaya produksi yang lebih tinggi, dan kebijakan moneter. Inflasi moderat dianggap sehat untuk pertumbuhan ekonomi, tetapi inflasi yang terlalu tinggi atau deflasi dapat merugikan. Investor dan manajer keuangan harus mempertimbangkan inflasi dalam strategi mereka untuk memastikan bahwa pengembalian investasi melebihi laju inflasi.","Apa itu inflasi dan bagaimana pengaruhnya terhadap keuangan?","Inflasi adalah kenaikan umum dalam harga barang dan jasa dari waktu ke waktu, yang mengurangi daya beli uang",0
398,"Leverage adalah penggunaan utang untuk meningkatkan potensi pengembalian investasi. Leverage dapat digunakan oleh individu, perusahaan, dan investor untuk membeli aset dengan modal yang lebih kecil daripada yang diperlukan. Namun, leverage juga meningkatkan risiko karena kewajiban untuk membayar bunga dan pokok utang tetap ada terlepas dari kinerja aset. Mengelola leverage dengan hati-hati adalah penting untuk menghindari kerugian besar dan menjaga kesehatan keuangan.","Apa yang dimaksud dengan leverage dalam konteks keuangan?","Leverage adalah penggunaan utang untuk meningkatkan potensi pengembalian investasi",0
399,"Kapitalisasi pasar adalah total nilai pasar dari saham yang beredar dari sebuah perusahaan, dihitung dengan mengalikan harga saham dengan jumlah saham yang beredar. Kapitalisasi pasar digunakan untuk mengkategorikan perusahaan menjadi perusahaan besar, menengah, dan kecil. Ini memberikan gambaran tentang ukuran dan nilai perusahaan di pasar. Investor sering menggunakan kapitalisasi pasar untuk menilai risiko dan potensi pengembalian investasi, dengan perusahaan besar dianggap lebih stabil tetapi mungkin tumbuh lebih lambat dibandingkan perusahaan kecil.","Apa itu kapitalisasi pasar dan bagaimana itu digunakan oleh investor?","Kapitalisasi pasar adalah total nilai pasar dari saham yang beredar dari sebuah perusahaan",0
400,"Pendapatan pasif adalah pendapatan yang dihasilkan dari sumber selain pekerjaan tetap atau bisnis aktif. Contoh pendapatan pasif termasuk sewa properti, bunga dari investasi, dan dividen saham. Pendapatan pasif penting untuk mencapai kebebasan finansial karena memungkinkan seseorang untuk memperoleh pendapatan tanpa harus bekerja secara aktif. Membangun sumber pendapatan pasif memerlukan investasi awal, tetapi dapat menghasilkan aliran pendapatan yang stabil dan berkelanjutan.","Apa itu pendapatan pasif dan mengapa itu penting?","Pendapatan pasif adalah pendapatan yang dihasilkan dari sumber selain pekerjaan tetap atau bisnis aktif",0
401,"Pemahaman tentang rasio keuangan adalah kunci dalam analisis keuangan. Rasio keuangan seperti rasio likuiditas, profitabilitas, dan solvabilitas memberikan gambaran tentang kesehatan keuangan perusahaan. Rasio likuiditas menunjukkan kemampuan perusahaan untuk memenuhi kewajiban jangka pendek, rasio profitabilitas mengukur kemampuan menghasilkan laba, dan rasio solvabilitas menilai kemampuan jangka panjang untuk membayar utang. Analisis rasio membantu investor dan manajer dalam pengambilan keputusan yang lebih baik.","Apa pentingnya memahami rasio keuangan dalam analisis keuangan?","Rasio keuangan seperti rasio likuiditas, profitabilitas, dan solvabilitas memberikan gambaran tentang kesehatan keuangan perusahaan",0
402,"Pajak adalah kontribusi wajib kepada pemerintah yang dikenakan pada pendapatan, properti, penjualan, dan aktivitas ekonomi lainnya. Pajak digunakan untuk membiayai layanan publik seperti pendidikan, kesehatan, infrastruktur, dan keamanan. Memahami kewajiban pajak dan perencanaan pajak yang efektif dapat membantu individu dan bisnis mengurangi beban pajak dan mematuhi hukum. Perencanaan pajak melibatkan penggunaan kredit pajak, pengurangan, dan strategi lain untuk mengoptimalkan kewajiban pajak.","Apa yang dimaksud dengan pajak dan bagaimana perencanaannya penting?","Pajak adalah kontribusi wajib kepada pemerintah yang dikenakan pada pendapatan, properti, penjualan, dan aktivitas ekonomi lainnya",0
403,"Investasi jangka panjang adalah strategi keuangan yang melibatkan penanaman modal dalam aset yang diharapkan akan tumbuh nilainya selama periode waktu yang panjang, biasanya lebih dari lima tahun. Contoh investasi jangka panjang termasuk saham, obligasi, dan real estat. Keuntungan dari investasi jangka panjang adalah potensi untuk mendapatkan pengembalian yang lebih tinggi dan mengurangi dampak fluktuasi pasar jangka pendek. Namun, investasi jangka panjang juga memerlukan kesabaran dan toleransi terhadap risiko.","Apa itu investasi jangka panjang dan apa keuntungannya?","Investasi jangka panjang adalah strategi keuangan yang melibatkan penanaman modal dalam aset yang diharapkan akan tumbuh nilainya selama periode waktu yang panjang",0
404,"Nilai bersih adalah total aset yang dimiliki oleh individu atau perusahaan dikurangi dengan total kewajiban atau utang. Nilai bersih adalah ukuran penting dari kesehatan keuangan dan kekayaan. Untuk individu, aset termasuk uang tunai, investasi, properti, dan barang berharga lainnya, sementara kewajiban termasuk utang hipotek, pinjaman, dan hutang kartu kredit. Meningkatkan nilai bersih melibatkan mengelola utang dengan baik dan mengakumulasi aset secara bijaksana. Nilai bersih yang positif menunjukkan stabilitas keuangan dan kemampuan untuk mencapai tujuan keuangan jangka panjang.","Apa yang dimaksud dengan nilai bersih dan bagaimana itu dihitung?","Nilai bersih adalah total aset yang dimiliki oleh individu atau perusahaan dikurangi dengan total kewajiban atau utang",0
405,"Manajemen keuangan adalah proses perencanaan, pengorganisasian, mengarahkan, dan mengendalikan kegiatan keuangan seperti pengadaan dan pemanfaatan dana perusahaan. Manajemen keuangan bertujuan untuk memaksimalkan nilai perusahaan dan memastikan bahwa sumber daya keuangan digunakan secara efisien dan efektif. Hal ini melibatkan pengambilan keputusan mengenai investasi, pembiayaan, dan dividen. Manajemen keuangan yang baik membantu perusahaan dalam mencapai tujuan jangka pendek dan jangka panjangnya.","Apa itu manajemen keuangan dan apa tujuannya?","Manajemen keuangan adalah proses perencanaan, pengorganisasian, mengarahkan, dan mengendalikan kegiatan keuangan seperti pengadaan dan pemanfaatan dana perusahaan",0
406,"Perencanaan pajak adalah proses menganalisis situasi keuangan dari perspektif pajak untuk meminimalkan kewajiban pajak secara legal. Perencanaan pajak melibatkan pengaturan pendapatan, pengeluaran, dan investasi untuk mengoptimalkan kewajiban pajak. Ini mencakup penggunaan insentif pajak, pengurangan, dan kredit pajak. Perencanaan pajak yang baik membantu individu dan perusahaan mematuhi hukum pajak sambil mengurangi beban pajak secara keseluruhan. Ini juga penting untuk menjaga arus kas dan stabilitas keuangan.","Apa yang dimaksud dengan perencanaan pajak dan mengapa itu penting?","Perencanaan pajak adalah proses menganalisis situasi keuangan dari perspektif pajak untuk meminimalkan kewajiban pajak secara legal",0
407,"Penganggaran adalah proses membuat rencana untuk mengelola pendapatan dan pengeluaran. Penganggaran membantu individu dan bisnis menetapkan prioritas keuangan dan memastikan bahwa dana dialokasikan dengan benar untuk memenuhi kebutuhan dan tujuan. Dengan penganggaran, seseorang dapat melacak pengeluaran, mengidentifikasi area di mana pengeluaran bisa dikurangi, dan menabung untuk masa depan. Penganggaran yang efektif adalah alat penting dalam mencapai stabilitas dan kesuksesan finansial.","Apa itu penganggaran dan bagaimana manfaatnya?","Penganggaran adalah proses membuat rencana untuk mengelola pendapatan dan pengeluaran",0
408,"Aset adalah segala sesuatu yang dimiliki oleh individu atau perusahaan yang memiliki nilai ekonomi. Aset dapat berupa kas, investasi, properti, inventaris, dan piutang. Aset digunakan untuk menghasilkan pendapatan dan mendukung operasi bisnis. Mengelola aset dengan baik adalah penting untuk menjaga likuiditas dan memastikan bahwa perusahaan atau individu memiliki cukup sumber daya untuk memenuhi kewajiban keuangan dan mencapai tujuan. Klasifikasi aset dapat membantu dalam pelaporan keuangan dan analisis kinerja.","Apa yang dimaksud dengan aset dalam konteks keuangan?","Aset adalah segala sesuatu yang dimiliki oleh individu atau perusahaan yang memiliki nilai ekonomi",0
409,"Liabilitas adalah kewajiban keuangan yang harus dibayar oleh individu atau perusahaan kepada pihak lain. Contoh liabilitas termasuk pinjaman, utang dagang, dan obligasi. Liabilitas dikategorikan menjadi jangka pendek dan jangka panjang, tergantung pada waktu jatuh tempo pembayaran. Mengelola liabilitas dengan baik adalah penting untuk menjaga kesehatan keuangan dan memastikan bahwa kewajiban dapat dipenuhi tepat waktu. Liabilitas yang tinggi dibandingkan dengan aset dapat menunjukkan risiko keuangan yang lebih besar.","Apa itu liabilitas dan mengapa penting dalam keuangan?","Liabilitas adalah kewajiban keuangan yang harus dibayar oleh individu atau perusahaan kepada pihak lain",0
410,"Ekuitas pemegang saham adalah jumlah uang yang diinvestasikan oleh pemegang saham dalam perusahaan ditambah laba ditahan. Ekuitas ini mencerminkan nilai kepemilikan pemegang saham dalam perusahaan setelah semua kewajiban dilunasi. Ekuitas pemegang saham adalah ukuran penting dari kesehatan keuangan perusahaan dan kemampuan untuk menghasilkan keuntungan. Ini juga digunakan untuk menghitung berbagai rasio keuangan yang membantu dalam analisis investasi dan keputusan manajemen.","Apa yang dimaksud dengan ekuitas pemegang saham?","Ekuitas pemegang saham adalah jumlah uang yang diinvestasikan oleh pemegang saham dalam perusahaan ditambah laba ditahan",0
411,"Likuiditas adalah kemampuan suatu perusahaan atau individu untuk memenuhi kewajiban jangka pendek tanpa mengalami kesulitan keuangan. Likuiditas diukur dengan membandingkan aset likuid dengan kewajiban jangka pendek. Rasio likuiditas yang tinggi menunjukkan bahwa entitas tersebut memiliki cukup aset likuid untuk menutupi utang jangka pendek. Mengelola likuiditas dengan baik penting untuk menjaga operasi bisnis berjalan lancar dan menghindari kebangkrutan atau tekanan keuangan.","Apa yang dimaksud dengan likuiditas dan bagaimana cara mengukurnya?","Likuiditas adalah kemampuan suatu perusahaan atau individu untuk memenuhi kewajiban jangka pendek tanpa mengalami kesulitan keuangan",0
412,"Kredit adalah perjanjian di mana peminjam menerima sesuatu yang berharga sekarang dan setuju untuk membayar kembali di masa depan, sering kali dengan bunga. Kredit dapat berupa pinjaman pribadi, hipotek, kartu kredit, atau kredit usaha. Memahami dan mengelola kredit adalah bagian penting dari keuangan pribadi dan bisnis. Penggunaan kredit yang bijaksana dapat membantu mencapai tujuan keuangan, seperti membeli rumah atau mengembangkan bisnis, sementara penggunaan yang tidak bijaksana dapat menyebabkan masalah utang.","Apa itu kredit dan bagaimana pengaruhnya terhadap keuangan?","Kredit adalah perjanjian di mana peminjam menerima sesuatu yang berharga sekarang dan setuju untuk membayar kembali di masa depan, sering kali dengan bunga",0
413,"Analisis fundamental adalah metode untuk mengevaluasi nilai intrinsik saham dengan memeriksa faktor-faktor ekonomi, keuangan, dan faktor lain yang terkait. Ini termasuk analisis laporan keuangan, kondisi industri, dan tren pasar. Analisis fundamental membantu investor menentukan apakah suatu saham dinilai dengan benar di pasar. Dengan menggunakan analisis ini, investor dapat membuat keputusan investasi yang lebih terinformasi dan meminimalkan risiko.","Apa yang dimaksud dengan analisis fundamental dalam investasi saham?","Analisis fundamental adalah metode untuk mengevaluasi nilai intrinsik saham dengan memeriksa faktor-faktor ekonomi, keuangan, dan faktor lain yang terkait",0
414,"Analisis teknikal adalah metode evaluasi aset keuangan berdasarkan data harga dan volume historis. Analis teknikal menggunakan grafik dan indikator statistik untuk mengidentifikasi pola dan tren yang dapat memberikan petunjuk tentang pergerakan harga di masa depan. Teknik ini sering digunakan oleh trader jangka pendek untuk membuat keputusan beli dan jual. Meskipun tidak memperhitungkan nilai intrinsik, analisis teknikal dapat membantu dalam mengidentifikasi peluang perdagangan yang menguntungkan.","Apa yang dimaksud dengan analisis teknikal dalam perdagangan saham?","Analisis teknikal adalah metode evaluasi aset keuangan berdasarkan data harga dan volume historis",0
415,"Penghasilan aktif adalah pendapatan yang diperoleh dari pekerjaan atau bisnis aktif, seperti gaji, upah, atau keuntungan usaha. Ini berbeda dari penghasilan pasif, yang diperoleh dari investasi atau sumber lain yang tidak memerlukan partisipasi aktif. Mengelola penghasilan aktif melibatkan perencanaan anggaran, pengelolaan pengeluaran, dan tabungan untuk masa depan. Penghasilan aktif adalah komponen utama dari keuangan pribadi dan sumber dana utama untuk memenuhi kebutuhan sehari-hari dan mencapai tujuan jangka panjang.","Apa yang dimaksud dengan penghasilan aktif?","Penghasilan aktif adalah pendapatan yang diperoleh dari pekerjaan atau bisnis aktif, seperti gaji, upah, atau keuntungan usaha",0
416,"Pembiayaan adalah proses menyediakan dana untuk tujuan bisnis atau pribadi. Ini dapat dilakukan melalui pinjaman bank, penerbitan obligasi, penjualan saham, atau pembiayaan ekuitas. Pembiayaan memungkinkan perusahaan untuk mengembangkan operasi, melakukan investasi, atau mengatasi kekurangan dana sementara. Mengelola pembiayaan dengan bijak melibatkan memilih sumber dana yang paling sesuai dengan kebutuhan dan kemampuan untuk membayar kembali. Pembiayaan yang baik dapat mendukung pertumbuhan dan stabilitas keuangan.","Apa itu pembiayaan dan bagaimana cara mengelolanya?","Pembiayaan adalah proses menyediakan dana untuk tujuan bisnis atau pribadi",0
417,"Volatilitas pasar mengacu pada fluktuasi harga yang cepat dan signifikan dalam pasar keuangan. Volatilitas dapat disebabkan oleh berbagai faktor, termasuk berita ekonomi, peristiwa politik, dan perubahan kondisi pasar. Volatilitas yang tinggi menunjukkan ketidakstabilan pasar, sementara volatilitas yang rendah menunjukkan stabilitas. Investor perlu memahami dan mengelola volatilitas karena dapat mempengaruhi nilai investasi mereka. Diversifikasi portofolio dan strategi lindung nilai adalah cara untuk mengurangi dampak volatilitas.","Apa yang dimaksud dengan volatilitas pasar dan bagaimana cara mengelolanya?","Volatilitas pasar mengacu pada fluktuasi harga yang cepat dan signifikan dalam pasar keuangan",0
418,"Diversifikasi adalah strategi investasi yang melibatkan penyebaran dana ke berbagai aset atau instrumen untuk mengurangi risiko. Dengan berinvestasi dalam berbagai aset seperti saham, obligasi, dan properti, investor dapat mengurangi dampak negatif dari penurunan nilai salah satu aset. Diversifikasi membantu dalam mencapai keseimbangan antara risiko dan pengembalian, dan merupakan prinsip dasar dalam manajemen portofolio. Strategi diversifikasi yang baik dapat melindungi portofolio dari volatilitas pasar.","Apa itu diversifikasi dan mengapa itu penting dalam investasi?","Diversifikasi adalah strategi investasi yang melibatkan penyebaran dana ke berbagai aset atau instrumen untuk mengurangi risiko",0
419,"Indeks pasar saham adalah ukuran kinerja sekelompok saham yang mewakili sektor tertentu atau pasar secara keseluruhan. Contoh indeks pasar saham termasuk S&P 500, Dow Jones Industrial Average, dan FTSE 100. Indeks pasar saham digunakan oleh investor untuk melacak kinerja pasar dan membandingkan kinerja portofolio mereka. Indeks juga digunakan sebagai acuan untuk produk investasi seperti reksa dana dan ETF. Memahami indeks pasar saham membantu investor membuat keputusan yang lebih baik dan mengelola risiko.","Apa itu indeks pasar saham dan bagaimana cara kerjanya?","Indeks pasar saham adalah ukuran kinerja sekelompok saham yang mewakili sektor tertentu atau pasar secara keseluruhan",0
420,"Pemasaran investasi adalah proses mempromosikan produk dan layanan investasi kepada calon investor. Ini melibatkan penggunaan berbagai strategi dan alat pemasaran untuk menarik minat dan menginformasikan investor tentang peluang investasi. Pemasaran investasi yang efektif memerlukan pemahaman tentang pasar sasaran, pengembangan pesan yang tepat, dan penggunaan saluran pemasaran yang sesuai. Tujuannya adalah untuk meningkatkan kesadaran, membangun kepercayaan, dan mendorong partisipasi investor dalam produk atau layanan investasi.","Apa itu pemasaran investasi dan bagaimana cara kerjanya?","Pemasaran investasi adalah proses mempromosikan produk dan layanan investasi kepada calon investor",0
421,"Arus kas adalah aliran masuk dan keluar uang dari bisnis atau individu dalam periode tertentu. Mengelola arus kas adalah penting untuk memastikan bahwa ada cukup dana untuk memenuhi kewajiban keuangan dan mendukung operasi sehari-hari. Arus kas yang positif menunjukkan bahwa entitas tersebut menghasilkan lebih banyak uang daripada yang dikeluarkan, sementara arus kas yang negatif menunjukkan sebaliknya. Laporan arus kas membantu dalam analisis kesehatan keuangan dan perencanaan strategi bisnis.","Apa itu arus kas dan mengapa penting dalam keuangan?","Arus kas adalah aliran masuk dan keluar uang dari bisnis atau individu dalam periode tertentu",0
422,"Pengelolaan risiko adalah proses mengidentifikasi, menilai, dan mengendalikan ancaman terhadap aset dan pendapatan perusahaan. Ancaman ini bisa berasal dari berbagai sumber, termasuk ketidakpastian keuangan, kewajiban hukum, kesalahan manajemen strategis, kecelakaan, dan bencana alam. Pengelolaan risiko melibatkan pengembangan strategi untuk mengurangi dampak risiko ini dan memastikan kelangsungan bisnis. Ini termasuk asuransi, diversifikasi, dan pengendalian internal yang efektif.","Apa yang dimaksud dengan pengelolaan risiko dan bagaimana caranya?","Pengelolaan risiko adalah proses mengidentifikasi, menilai, dan mengendalikan ancaman terhadap aset dan pendapatan perusahaan",0
423,"Leverage keuangan adalah penggunaan dana pinjaman untuk meningkatkan potensi pengembalian dari investasi. Leverage dapat memperbesar keuntungan tetapi juga memperbesar risiko kerugian. Contoh leverage termasuk penggunaan margin untuk membeli saham atau mengambil pinjaman untuk membeli properti. Mengelola leverage dengan hati-hati adalah penting untuk menghindari kebangkrutan dan kerugian besar. Investor harus memahami tingkat risiko yang mereka ambil dan memastikan bahwa mereka dapat memenuhi kewajiban keuangan mereka.","Apa itu leverage keuangan dan bagaimana dampaknya?","Leverage keuangan adalah penggunaan dana pinjaman untuk meningkatkan potensi pengembalian dari investasi",0
424,"Dana darurat adalah sejumlah uang yang disimpan untuk menutupi pengeluaran tak terduga atau darurat keuangan. Dana darurat biasanya setara dengan tiga hingga enam bulan biaya hidup dan disimpan dalam rekening yang mudah diakses. Memiliki dana darurat penting untuk memberikan keamanan finansial dan menghindari utang saat menghadapi situasi seperti kehilangan pekerjaan, kecelakaan, atau perbaikan rumah yang mendesak. Dana darurat juga membantu dalam menjaga stabilitas keuangan jangka panjang.","Apa itu dana darurat dan mengapa itu penting?","Dana darurat adalah sejumlah uang yang disimpan untuk menutupi pengeluaran tak terduga atau darurat keuangan",0
425,"Analisis kredit adalah proses mengevaluasi kelayakan kredit dari individu atau perusahaan. Ini melibatkan pemeriksaan laporan kredit, riwayat pembayaran, dan kapasitas keuangan untuk menentukan kemampuan untuk membayar kembali pinjaman. Analisis kredit penting bagi pemberi pinjaman untuk mengurangi risiko kredit macet dan memastikan bahwa pinjaman diberikan kepada peminjam yang layak. Hasil analisis kredit membantu dalam menentukan persyaratan pinjaman, termasuk suku bunga dan jangka waktu.","Apa itu analisis kredit dan mengapa penting?","Analisis kredit adalah proses mengevaluasi kelayakan kredit dari individu atau perusahaan",0
426,"Finansial merujuk pada segala sesuatu yang berkaitan dengan pengelolaan uang, termasuk investasi, perbankan, kredit, pasar modal, dan asuransi. Finansial mencakup aktivitas pengambilan keputusan yang melibatkan uang, baik dalam skala individu, perusahaan, maupun pemerintah. Pengelolaan finansial yang efektif memerlukan pemahaman tentang cara mengalokasikan sumber daya yang terbatas untuk memaksimalkan keuntungan dan meminimalkan risiko. Finansial juga melibatkan perencanaan keuangan jangka panjang dan pendek untuk mencapai tujuan ekonomi tertentu.","Apa itu finansial?","Finansial merujuk pada segala sesuatu yang berkaitan dengan pengelolaan uang, termasuk investasi, perbankan, kredit, pasar modal, dan asuransi",0
427,"Finansial dalam konteks perusahaan mencakup berbagai aspek seperti penganggaran, pelaporan keuangan, manajemen utang, dan investasi. Departemen keuangan bertanggung jawab untuk memastikan bahwa perusahaan memiliki dana yang cukup untuk operasional dan pertumbuhan. Ini juga termasuk pengelolaan risiko, likuiditas, dan profitabilitas. Keputusan finansial yang tepat sangat penting untuk keberlanjutan dan kesuksesan jangka panjang perusahaan. Dengan memahami finansial, perusahaan dapat mengoptimalkan sumber daya mereka dan meningkatkan nilai pemegang saham.","Bagaimana finansial berperan dalam konteks perusahaan?","Finansial dalam konteks perusahaan mencakup berbagai aspek seperti penganggaran, pelaporan keuangan, manajemen utang, dan investasi",0
