id,context,question,answer,answer_start
109,"cara mengelola gaji untuk mencapai financial freedom","Bagaimana cara mengelola gaji yang pas-pasan untuk mencapai financial freedom?","Mulailah dengan membuat anggaran yang ketat dan memprioritaskan tabungan. Kurangi pengeluaran tidak penting, cari sumber penghasilan tambahan, dan berinvestasilah dalam instrumen keuangan yang sesuai dengan profil risiko Anda.",0
110,"KPR rumah","Apakah membeli rumah dengan KPR merupakan langkah yang tepat untuk mencapai financial freedom?","Membeli rumah dengan KPR bisa menjadi langkah yang tepat jika dilakukan dengan perencanaan yang matang. Pastikan cicilan KPR tidak melebihi 30% dari pendapatan bulanan dan pilih tenor yang sesuai dengan kemampuan finansial",0
111,"cara mengelola utang kartu kredit","Bagaimana cara mengelola utang kartu kredit agar tidak menjadi beban finansial?","Lunasi utang kartu kredit secepat mungkin dengan membayar lebih dari pembayaran minimum setiap bulan. Hindari penggunaan kartu kredit untuk pengeluaran yang tidak penting dan pertimbangkan untuk mengonsolidasikan utang jika bunga terlalu tinggi.",0
112,"memulai bisnis dengan modal kecil","Apa yang harus dilakukan jika saya ingin memulai bisnis dengan modal kecil dari gaji saya?","Mulailah dengan membuat rencana bisnis yang jelas dan realistis. Sisihkan sebagian gaji sebagai modal awal dan cari cara untuk meminimalkan biaya operasional. Anda juga bisa memanfaatkan pinjaman mikro atau mencari investor untuk mendukung bisnis Anda.",0
113,"cara mengelola keuangan jika sandwich generation","Bagaimana cara mengelola keuangan jika saya merupakan generasi sandwich yang harus mengurus orang tua dan anak?","Prioritaskan kebutuhan dasar dan buat anggaran yang mencakup semua tanggungan. Cari sumber pendapatan tambahan dan pertimbangkan asuransi kesehatan untuk mengurangi beban biaya medis. Jangan lupa untuk tetap menabung dan berinvestasi untuk masa depan.",0
114,"asuransi kesehatan dan asuransi pendidikan","Apakah asuransi kesehatan dan pendidikan merupakan bagian dari perencanaan keuangan yang tepat?","Ya, asuransi kesehatan dan pendidikan sangat penting dalam perencanaan keuangan. Asuransi kesehatan membantu melindungi dari biaya medis yang tak terduga, sedangkan asuransi pendidikan memastikan anak-anak Anda mendapatkan pendidikan yang layak tanpa mengganggu stabilitas keuangan Anda.",0
115,"cara mengatur keuangan agar tidak terjebak utang","Bagaimana cara efektif mengatur keuangan agar tidak terjebak dalam lingkaran utang?","Buat anggaran bulanan yang realistis dan disiplin dalam mengikutinya. Prioritaskan pelunasan utang berbunga tinggi terlebih dahulu dan hindari pengeluaran yang tidak perlu. Selalu sisihkan sebagian penghasilan untuk dana darurat agar tidak bergantung pada utang saat menghadapi situasi mendesak.",0
116,"tips mengelola keuangan bulanan","Apa yang harus dilakukan jika penghasilan tidak cukup untuk menutupi pengeluaran bulanan?","Evaluasi kembali pengeluaran bulanan dan potong biaya yang tidak penting. Cari sumber penghasilan tambahan, seperti pekerjaan paruh waktu atau freelance, dan pertimbangkan untuk berinvestasi dalam keterampilan yang dapat meningkatkan pendapatan Anda.",0
117,"cara mengatur keuangan jika pendapatan tidak tetap","Bagaimana cara mengatur keuangan jika memiliki penghasilan tidak tetap?","Buat anggaran fleksibel yang dapat disesuaikan dengan fluktuasi penghasilan. Prioritaskan pengeluaran penting dan sisihkan dana darurat untuk menghadapi periode penghasilan rendah. Pertimbangkan untuk memiliki beberapa sumber penghasilan untuk menjaga stabilitas keuangan.",0
118,"asuransi jiwa","Apakah penting memiliki asuransi jiwa dalam perencanaan keuangan?","Ya, asuransi jiwa penting untuk melindungi keluarga dari risiko finansial jika terjadi sesuatu pada pencari nafkah utama. Asuransi jiwa dapat membantu memastikan keluarga tetap terjaga secara finansial dalam jangka panjang.",0
119,"mengelola keuangan antara membayar cicilan KPR dan menabung","Bagaimana cara mengatur keuangan untuk membayar cicilan KPR dan tetap menabung?","Buat anggaran yang mencakup cicilan KPR dan tetap prioritaskan tabungan. Pertimbangkan untuk memotong pengeluaran tidak penting dan cari cara untuk meningkatkan penghasilan. Disiplin dalam mengikuti anggaran agar keuangan tetap stabil.",0
120,"cara memilih investasi yang tepat","Bagaimana cara memilih investasi yang tepat dengan penghasilan 5 juta per bulan?","Mulailah dengan instrumen investasi berisiko rendah seperti reksa dana pasar uang atau deposito. Seiring peningkatan pemahaman dan pengalaman, pertimbangkan diversifikasi ke instrumen dengan risiko lebih tinggi seperti saham atau properti",0
121,"cara mengelola utang yang tepat","Bagaimana cara mengelola utang pinjaman pribadi agar tidak membebani keuangan?","Buat rencana pelunasan utang yang jelas dan fokus pada pembayaran utang berbunga tinggi terlebih dahulu. Hindari mengambil utang tambahan dan disiplin dalam mengikuti rencana pembayaran utang",0
122,"investasi properti","Apa saja yang harus dipertimbangkan sebelum berinvestasi dalam properti?","Pertimbangkan lokasi, potensi pertumbuhan nilai, dan biaya pemeliharaan properti. Lakukan riset pasar secara menyeluruh dan pastikan kondisi keuangan Anda stabil untuk menutupi biaya tambahan yang mungkin timbul.",0
123,"pentingnya memiliki rencana keuangan jangka panjang","Apakah penting memiliki rencana keuangan jangka panjang?","Ya, rencana keuangan jangka panjang penting untuk mencapai tujuan finansial seperti membeli rumah, pendidikan anak, dan pensiun. Rencana ini membantu mengarahkan pengelolaan keuangan secara efektif dan memastikan tujuan finansial tercapai tepat waktu.",0
124,"tips mengoptimalkan tabungan dan investasi agar bisa pensiun sedini mungkin","Bagaimana cara mengoptimalkan tabungan dan investasi agar bisa pensiun lebih awal?","Mulailah menabung dan berinvestasi sejak dini, diversifikasi portofolio investasi, dan maksimalkan penghasilan. Kurangi pengeluaran yang tidak perlu dan disiplin dalam menabung serta mengelola investasi untuk mencapai tujuan pensiun lebih awal.",0
125,"asuransi kesehatan","Bagaimana cara memilih asuransi kesehatan yang tepat?","Pilih asuransi kesehatan yang sesuai dengan kebutuhan dan kondisi kesehatan Anda. Pertimbangkan cakupan manfaat, premi yang terjangkau, dan jaringan rumah sakit yang bekerja sama dengan perusahaan asuransi tersebut.",0
126,"mengelola keuangan keluarga","Apa saja yang perlu diperhatikan dalam mengelola keuangan keluarga?","Buat anggaran keluarga yang mencakup semua pengeluaran dan pendapatan, alokasikan dana untuk tabungan dan investasi, serta pastikan memiliki asuransi untuk melindungi keluarga dari risiko finansial. Komunikasi yang baik antara anggota keluarga juga penting untuk mengelola keuangan secara efektif.",0
127,"tips mengelola gaji untuk investasi dalam bisnis kecil","Bagaimana cara mengelola gaji untuk berinvestasi dalam bisnis kecil?","Sisihkan sebagian gaji sebagai modal awal, buat rencana bisnis yang jelas, dan mulai dengan bisnis yang memerlukan modal kecil. Monitor pengeluaran bisnis dengan ketat dan reinvestasikan keuntungan untuk mengembangkan bisnis secara bertahap.",0
128,"cara mengatur keuangan jika memiliki 2 sumber penghasilan atau lebih","Bagaimana cara mengatur keuangan jika memiliki dua sumber penghasilan?","Buat anggaran yang mencakup kedua sumber penghasilan dan alokasikan dana untuk pengeluaran penting, tabungan, dan investasi. Manfaatkan kelebihan penghasilan untuk melunasi utang atau menambah investasi agar mencapai tujuan finansial lebih cepat.",0
129,"cara menabung khusus untuk liburan tanpa menganggu keuangan","Bagaimana cara menabung untuk liburan tanpa mengganggu keuangan bulanan?","Buat tabungan khusus untuk liburan dan sisihkan sebagian kecil dari setiap gaji. Rencanakan liburan dengan anggaran yang realistis dan cari cara untuk mengurangi biaya, seperti memanfaatkan promo atau berlibur di luar musim liburan.",0
130,"cara memulai investasi saham","Bagaimana cara mengelola keuangan jika ingin memulai investasi saham?","Pelajari dasar-dasar investasi saham, mulailah dengan jumlah kecil, dan pilih saham dari perusahaan yang memiliki kinerja baik. Diversifikasi portofolio saham Anda untuk mengurangi risiko dan selalu monitor perkembangan pasar.",0
131,"cara mencapai financial freedom saat memasuki usia pensiun","Bagaimana cara mengelola gaji untuk mencapai financial freedom saat memasuki usia pensiun?","Mulailah menabung dan berinvestasi sejak dini, diversifikasi portofolio investasi, dan maksimalkan penghasilan selama masih aktif bekerja. Kurangi pengeluaran yang tidak perlu dan pastikan memiliki dana pensiun yang cukup untuk hidup nyaman saat pensiun",0
132,"cara mengeloka keuangan yang tepat","Bagaimana cara mengelola keuangan untuk memastikan masa depan finansial yang stabil?","Buat rencana keuangan jangka panjang, alokasikan dana untuk tabungan dan investasi, serta lindungi diri dengan asuransi. Disiplin dalam mengelola keuangan sehari-hari dan terus belajar serta menyesuaikan rencana sesuai kebutuhan.",0
133,"langkah-langkah untuk mencapai financial freedom","Apa langkah-langkah praktis untuk membangun kekayaan secara efektif dan mencapai financial freedom pada usia muda?","Buat rencana keuangan yang jelas, sisihkan sebagian besar penghasilan untuk tabungan dan investasi, dan hindari utang konsumtif. Manfaatkan peluang investasi yang menguntungkan dan terus tingkatkan potensi penghasilan melalui keterampilan dan pendidikan.",0
134,"jenis jenis investasi","Apa saja investasi yang dapat dilakukan untuk mengamankan masa depan finansial dan mencapai financial freedom pada usia muda?","Mulailah dengan investasi berisiko rendah seperti reksa dana atau obligasi, dan diversifikasikan portofolio seiring dengan peningkatan pengetahuan dan pengalaman. Pertimbangkan investasi saham atau properti untuk potensi pertumbuhan nilai yang lebih tinggi.",0
135,"cicilan KPR","Apa yang harus dilakukan jika tidak mampu membayar cicilan KPR tepat waktu?","Segera hubungi bank atau pemberi pinjaman untuk membahas opsi restrukturisasi atau penjadwalan ulang cicilan. Jelaskan situasi keuangan Anda dan minta keringanan seperti penurunan bunga atau perpanjangan tenor.",0
136,"tagihan kartu kredit","Bagaimana cara mengatasi kesulitan membayar tagihan kartu kredit?","Hubungi bank penerbit kartu kredit dan ajukan permohonan restrukturisasi utang atau program pengampunan bunga. Selain itu, pertimbangkan untuk mengonsolidasikan utang kartu kredit dengan pinjaman berbunga lebih rendah.",0
137,"asuransi","Apa yang bisa dilakukan jika tidak mampu membayar premi asuransi?","Hubungi perusahaan asuransi untuk membahas opsi pembayaran alternatif atau penyesuaian premi. Beberapa perusahaan mungkin menawarkan penangguhan pembayaran sementara atau pengurangan cakupan sementara.",0
138,"cara mengelola utang yang tidak tepat waktu","Bagaimana cara mengelola utang yang menumpuk dan tidak mampu membayarnya?","Buat daftar semua utang dan prioritaskan pembayaran utang dengan bunga tertinggi. Pertimbangkan untuk mencari bantuan dari konsultan keuangan atau lembaga pengelolaan utang untuk membuat rencana pelunasan yang realistis.",0
139,"cicilan pribadi","Apa yang harus dilakukan jika tidak mampu membayar cicilan pinjaman pribadi?","Hubungi pemberi pinjaman dan diskusikan situasi keuangan Anda. Minta opsi restrukturisasi atau penjadwalan ulang cicilan. Beberapa pemberi pinjaman mungkin menawarkan penundaan pembayaran atau penurunan bunga sementara.",0
140,"mengatur keuangan untuk melunasi utang","Bagaimana cara mengatur keuangan jika mengalami penurunan pendapatan dan kesulitan membayar utang?","Evaluasi kembali anggaran dan potong pengeluaran yang tidak penting. Prioritaskan pembayaran utang dan kebutuhan dasar. Cari sumber penghasilan tambahan dan diskusikan opsi restrukturisasi utang dengan pemberi pinjaman.",0
141,"risiko gagal KPR","Apa yang bisa dilakukan jika menghadapi risiko gagal bayar KPR?","Pertimbangkan untuk menjual aset atau properti yang tidak diperlukan untuk mendapatkan dana tambahan. Diskusikan dengan bank mengenai opsi refinancing atau penundaan pembayaran cicilan.",0
142,"asuransi kesehatan","Bagaimana cara mengatasi kesulitan membayar premi asuransi kesehatan?","Hubungi perusahaan asuransi dan jelaskan situasi keuangan Anda. Beberapa perusahaan mungkin menawarkan penangguhan pembayaran sementara atau mengubah rencana asuransi ke yang lebih terjangkau.",0
143,"mengelola keuangan untuk melunasi utang","Bagaimana cara mengelola keuangan jika terjebak dalam lingkaran utang?","Buat anggaran yang ketat dan disiplin dalam mengikutinya. Pertimbangkan untuk mendapatkan bantuan dari konsultan keuangan untuk membuat rencana pelunasan utang yang efektif. Fokus pada pembayaran utang berbunga tinggi terlebih dahulu.",0
144,"membayar angsuran kendaran","Apa yang bisa dilakukan jika tidak mampu membayar angsuran kendaraan?","Hubungi lembaga pembiayaan dan diskusikan opsi restrukturisasi atau penjadwalan ulang angsuran. Jika perlu, pertimbangkan untuk menjual kendaraan dan menggunakan hasil penjualan untuk melunasi utang.",0
145,"cara mengatur keuangan jika terkena PHK dann terlilit utang","Bagaimana cara mengatur keuangan jika mengalami PHK dan kesulitan membayar utang?","Segera buat anggaran darurat dan potong pengeluaran tidak penting. Prioritaskan pembayaran utang penting dan kebutuhan dasar. Cari sumber penghasilan sementara, seperti pekerjaan paruh waktu atau freelance, dan diskusikan opsi restrukturisasi utang dengan pemberi pinjaman.",0
146,"pinjaman online","Bagaimana cara mengelola keuangan jika memiliki utang pinjaman online yang menumpuk?","Buat daftar semua pinjaman online dan prioritaskan pembayaran yang paling mendesak. Hubungi pemberi pinjaman untuk membahas opsi penjadwalan ulang atau pengurangan bunga. Hindari mengambil pinjaman online tambahan untuk melunasi utang yang ada.",0
147,"cicilan properti investasi","Apa yang bisa dilakukan jika tidak mampu membayar cicilan properti investasi?","Pertimbangkan untuk menyewakan properti untuk menghasilkan pendapatan tambahan yang bisa digunakan untuk membayar cicilan. Diskusikan opsi refinancing atau restrukturisasi cicilan dengan bank.",0
148,"cara mengelola keuangan jika sandwich generation","Bagaimana cara mengelola keuangan jika harus mengurus orang tua yang sakit dan membutuhkan biaya tinggi?","Buat anggaran yang mencakup semua biaya perawatan dan prioritaskan pengeluaran. Cari sumber pendapatan tambahan dan pertimbangkan untuk mencari bantuan dari program pemerintah atau organisasi amal yang menawarkan dukungan untuk perawatan orang tua.",0
149,"cicilan properti","Apa yang bisa dilakukan jika tidak mampu membayar cicilan properti komersial?","Hubungi bank atau pemberi pinjaman dan diskusikan opsi restrukturisasi atau penjadwalan ulang cicilan. Pertimbangkan untuk menyewakan properti atau mencari partner bisnis untuk membantu membayar cicilan.",0
150,"cara mengelola keuangan untuk membayar utang","Bagaimana cara mengelola keuangan jika harus membayar utang dalam mata uang asing yang semakin mahal karena kurs?","Pertimbangkan untuk mengonversi utang ke mata uang lokal jika memungkinkan. Cari cara untuk meningkatkan penghasilan dalam mata uang asing atau hedging untuk melindungi diri dari fluktuasi kurs.",0
151,"cicilan peralatan bisnis","Apa yang bisa dilakukan jika tidak mampu membayar cicilan peralatan bisnis?","Hubungi lembaga pembiayaan dan diskusikan opsi restrukturisasi atau penjadwalan ulang cicilan. Pertimbangkan untuk menjual peralatan yang tidak digunakan atau mencari partner bisnis untuk membantu membayar cicilan.",0
152,"cara mengelola keuangan untuk membayar utang","Bagaimana cara mengelola keuangan jika terjebak dalam lingkaran utang konsumtif?","Buat anggaran yang ketat dan disiplin dalam mengikutinya. Hindari utang tambahan dan fokus pada pelunasan utang berbunga tinggi. Cari bantuan dari konsultan keuangan untuk membuat rencana pelunasan utang yang efektif.",0
153,"asuransi kesehatan keluarga","Apa yang bisa dilakukan jika tidak mampu membayar biaya bulanan asuransi kesehatan keluarga?","Hubungi perusahaan asuransi dan minta opsi pembayaran alternatif atau penyesuaian premi. Pertimbangkan untuk mencari program asuransi kesehatan pemerintah atau organisasi amal yang menawarkan bantuan.",0
