id,context,question,answer,answer_start
213,"Portofolio adalah kumpulan investasi yang dimiliki oleh individu atau entitas tertentu. Portofolio dapat terdiri dari berbagai jenis investasi, termasuk saham, obligasi, reksa dana, dan properti. Tujuan dari portofolio adalah untuk mencapai diversifikasi yang optimal dan menghasilkan pengembalian yang diharapkan sesuai dengan toleransi risiko pemilik portofolio.","Apa yang dimaksud dengan portofolio?","Portofolio adalah kumpulan investasi yang dimiliki oleh individu atau entitas tertentu",0
214,"Resesi adalah periode kontraksi ekonomi yang terjadi ketika pertumbuhan ekonomi negatif selama dua kuartal berturut-turut. Resesi dapat disebabkan oleh berbagai faktor ekonomi, termasuk penurunan permintaan konsumen, penurunan investasi, atau kebijakan moneter yang ketat.","Apa yang dimaksud dengan resesi?","Resesi adalah periode kontraksi ekonomi yang terjadi ketika pertumbuhan ekonomi negatif selama dua kuartal berturut-turut",0
215,"Pengangguran adalah kondisi di mana individu yang ingin bekerja tidak dapat menemukan pekerjaan yang sesuai dengan kualifikasi atau keinginan mereka. Tingkat pengangguran sering digunakan sebagai indikator kesehatan ekonomi suatu negara, dengan tingkat pengangguran yang tinggi menunjukkan perlambatan ekonomi dan tingkat pengangguran yang rendah menunjukkan pertumbuhan ekonomi.","Apa yang dimaksud dengan pengangguran?","Pengangguran adalah kondisi di mana individu yang ingin bekerja tidak dapat menemukan pekerjaan yang sesuai dengan kualifikasi atau keinginan mereka",0
216,"Ekuitas adalah kepemilikan dalam suatu aset, perusahaan, atau properti. Ini sering merujuk pada saham dalam suatu perusahaan, yang memberikan pemegangnya kepemilikan bagian dari perusahaan tersebut. Ekuitas juga dapat merujuk pada nilai pasar atas kepemilikan rumah atau properti lainnya setelah dikurangi jumlah utang yang terkait.","Apa yang dimaksud dengan ekuitas?","Ekuitas adalah kepemilikan dalam suatu aset, perusahaan, atau properti",0
217,"Dana darurat adalah dana yang disisihkan untuk mengatasi kebutuhan mendesak atau keadaan darurat yang tak terduga, seperti kehilangan pekerjaan atau biaya medis yang tidak terduga. Tujuan dari dana darurat adalah untuk memberikan perlindungan keuangan dan kestabilan dalam situasi krisis.","Apa yang dimaksud dengan dana darurat?","Dana darurat adalah dana yang disisihkan untuk mengatasi kebutuhan mendesak atau keadaan darurat yang tak terduga",0
218,"Kebebasan finansial adalah kemampuan seseorang untuk hidup tanpa bergantung pada gaji bulanan atau pekerjaan tetap. Ini mencakup memiliki sumber pendapatan pasif yang cukup untuk memenuhi kebutuhan finansial serta mengejar tujuan hidup yang diinginkan. Seseorang yang mencapai kebebasan finansial memiliki fleksibilitas dan kontrol atas kehidupan keuangan mereka, memungkinkan mereka untuk mengejar minat, hobi, atau perjalanan tanpa harus khawatir tentang masalah keuangan.","Apa yang dimaksud dengan kebebasan finansial?","Kebebasan finansial adalah kemampuan seseorang untuk hidup tanpa bergantung pada gaji bulanan atau pekerjaan tetap",0
219,"Untuk mencapai kebebasan finansial, seseorang harus memperhatikan beberapa aspek keuangan, termasuk menyisihkan sebagian pendapatan untuk investasi, membangun portofolio investasi yang beragam, mengelola hutang dengan bijak, dan mengembangkan sumber pendapatan pasif seperti sewa properti, investasi dividen, atau bisnis online. Disiplin dan perencanaan yang matang diperlukan untuk mencapai tujuan kebebasan finansial.","Apa yang diperlukan untuk mencapai kebebasan finansial?","Disiplin dan perencanaan yang matang diperlukan untuk mencapai tujuan kebebasan finansial",0
220,"Investasi adalah kunci utama dalam mencapai kebebasan finansial. Dengan berinvestasi secara bijak, seseorang dapat memanfaatkan pertumbuhan aset dan penghasilan pasif untuk memperoleh kebebasan finansial. Investasi dapat meliputi berbagai instrumen seperti saham, obligasi, reksa dana, properti, atau bisnis. Penting untuk melakukan riset dan diversifikasi portofolio investasi untuk mengurangi risiko dan meningkatkan peluang keberhasilan.","Apa yang menjadi kunci utama dalam mencapai kebebasan finansial?","Investasi adalah kunci utama dalam mencapai kebebasan finansial",0
221,"Kedisiplinan keuangan adalah aspek penting dalam perjalanan menuju kebebasan finansial. Ini melibatkan pengaturan anggaran yang realistis, menghindari pembelian impulsif, dan menyisihkan sebagian pendapatan untuk tabungan atau investasi. Dengan kedisiplinan keuangan yang kuat, seseorang dapat mengendalikan pengeluaran, mengurangi hutang, dan membangun kekayaan untuk mencapai kebebasan finansial di masa depan.","Apa yang penting dalam perjalanan menuju kebebasan finansial?","Kedisiplinan keuangan adalah aspek penting dalam perjalanan menuju kebebasan finansial",0
222,"Memahami perbedaan antara aset dan liabilitas adalah kunci dalam mencapai kebebasan finansial. Aset adalah segala sesuatu yang menghasilkan uang atau meningkatkan nilai, seperti properti investasi, saham, atau bisnis. Di sisi lain, liabilitas adalah segala sesuatu yang menghabiskan uang atau mengurangi nilai, seperti utang kartu kredit atau cicilan mobil. Dengan memprioritaskan akumulasi aset dan mengurangi liabilitas, seseorang dapat mempercepat perjalanan menuju kebebasan finansial.","Apa yang penting dalam mencapai kebebasan finansial?","Memahami perbedaan antara aset dan liabilitas",0
223,"Pendidikan keuangan adalah langkah awal penting dalam mencapai kebebasan finansial. Ini melibatkan pemahaman tentang konsep keuangan dasar seperti pengelolaan anggaran, investasi, hutang, dan pajak. Dengan pengetahuan yang kuat tentang keuangan, seseorang dapat membuat keputusan yang lebih cerdas tentang bagaimana mengelola uang mereka, memaksimalkan penghasilan, dan mencapai tujuan keuangan jangka panjang.","Apa yang menjadi langkah awal penting dalam mencapai kebebasan finansial?","Pendidikan keuangan adalah langkah awal penting dalam mencapai kebebasan finansial",0
224,"Membangun multiple streams of income atau sumber pendapatan yang beragam adalah strategi yang efektif untuk mencapai kebebasan finansial. Ini melibatkan menciptakan berbagai sumber penghasilan, seperti gaji dari pekerjaan utama, penghasilan pasif dari investasi, royalti dari karya seni atau buku, dan penghasilan dari bisnis sampingan. Dengan mengembangkan multiple streams of income, seseorang dapat meningkatkan fleksibilitas keuangan dan mengurangi risiko kehilangan penghasilan secara tiba-tiba.","Apa yang menjadi strategi efektif untuk mencapai kebebasan finansial?","Membangun multiple streams of income atau sumber pendapatan yang beragam",0
225,"Pengelolaan risiko adalah aspek penting dalam perjalanan menuju kebebasan finansial. Ini melibatkan mengidentifikasi, menilai, dan mengelola risiko yang terkait dengan investasi, bisnis, atau kehidupan sehari-hari. Strategi pengelolaan risiko meliputi asuransi, diversifikasi investasi, dan peningkatan literasi keuangan untuk membuat keputusan yang lebih cerdas.","Apa yang menjadi aspek penting dalam perjalanan menuju kebebasan finansial?","Pengelolaan risiko adalah aspek penting dalam perjalanan menuju kebebasan finansial",0
226,"Hutang adalah jumlah uang yang dipinjam oleh individu atau entitas dari pihak lain, yang harus dikembalikan dengan bunga atau biaya tambahan. Hutang dapat berupa pinjaman dari bank, kartu kredit, hipotek, atau pinjaman dari teman atau keluarga. Sementara hutang dapat menjadi alat yang berguna untuk membiayai pembelian besar atau kebutuhan mendesak, pengelolaan hutang yang buruk dapat mengakibatkan masalah keuangan jangka panjang.","Apa yang dimaksud dengan hutang?","Hutang adalah jumlah uang yang dipinjam oleh individu atau entitas dari pihak lain, yang harus dikembalikan dengan bunga atau biaya tambahan",0
227,"Bunga adalah biaya tambahan yang dibebankan atas hutang yang belum dibayar. Ini adalah cara bagi pemberi pinjaman untuk menghasilkan pendapatan dari peminjam. Tingkat bunga dapat bervariasi tergantung pada jenis hutang, profil risiko peminjam, dan kondisi pasar keuangan.","Apa yang dimaksud dengan bunga dalam konteks hutang?","Bunga adalah biaya tambahan yang dibebankan atas hutang yang belum dibayar",0
228,"Hutang dapat diklasifikasikan menjadi dua jenis utama: hutang yang aman dan hutang yang tidak aman. Hutang yang aman dijamin oleh aset tertentu, seperti rumah (hipotek) atau mobil (pinjaman mobil). Di sisi lain, hutang yang tidak aman tidak dijamin oleh aset dan memiliki tingkat bunga yang lebih tinggi karena risiko yang lebih tinggi bagi pemberi pinjaman.","Apa saja jenis-jenis hutang?","Hutang dapat diklasifikasikan menjadi dua jenis utama: hutang yang aman dan hutang yang tidak aman",0
229,"Hutang dapat menjadi beban keuangan jika tidak dikelola dengan bijak. Beberapa tanda bahwa hutang telah menjadi masalah termasuk kesulitan membayar tagihan tepat waktu, meminjam uang untuk membayar hutang yang ada, atau terus menambah hutang baru untuk memenuhi kebutuhan finansial sehari-hari. Dalam kasus yang ekstrem, hutang yang tidak terkendali dapat mengarah pada kebangkrutan.","Bagaimana mengetahui apakah hutang telah menjadi masalah keuangan?","Beberapa tanda bahwa hutang telah menjadi masalah termasuk kesulitan membayar tagihan tepat waktu, meminjam uang untuk membayar hutang yang ada, atau terus menambah hutang baru untuk memenuhi kebutuhan finansial sehari-hari",0
230,"Konsolidasi hutang adalah strategi untuk menggabungkan beberapa hutang menjadi satu pinjaman besar dengan tingkat bunga yang lebih rendah. Ini dapat membantu memudahkan pengelolaan hutang, mengurangi jumlah pembayaran bulanan, dan menghemat uang dalam jangka panjang. Konsolidasi hutang dapat dilakukan melalui pinjaman pribadi, transfer saldo kartu kredit, atau program konseling kredit.","Apa yang dimaksud dengan konsolidasi hutang?","Konsolidasi hutang adalah strategi untuk menggabungkan beberapa hutang menjadi satu pinjaman besar dengan tingkat bunga yang lebih rendah",0
231,"Kesepakatan penyelesaian hutang adalah perjanjian antara pemberi pinjaman dan peminjam untuk membayar jumlah hutang yang lebih rendah dari jumlah yang sebenarnya terutang. Ini sering digunakan sebagai alternatif untuk kebangkrutan, karena memungkinkan peminjam untuk membayar kembali sebagian dari hutang mereka dan menghindari kerugian finansial yang lebih besar. Namun, kesepakatan penyelesaian hutang juga dapat berdampak negatif pada skor kredit dan riwayat kredit peminjam.","Apa yang dimaksud dengan kesepakatan penyelesaian hutang?","Kesepakatan penyelesaian hutang adalah perjanjian antara pemberi pinjaman dan peminjam untuk membayar jumlah hutang yang lebih rendah dari jumlah yang sebenarnya terutang",0
232,"Perencanaan pembayaran hutang adalah proses membuat rencana untuk membayar kembali hutang-hutang yang dimiliki. Ini melibatkan mengevaluasi jumlah hutang, tingkat bunga, dan sumber pendapatan untuk menentukan strategi pembayaran yang efektif. Perencanaan pembayaran hutang dapat mencakup strategi seperti membayar hutang dengan bunga tertinggi terlebih dahulu (metode bola salju) atau konsolidasi hutang untuk mengurangi jumlah pembayaran bulanan.","Apa yang dimaksud dengan perencanaan pembayaran hutang?","Perencanaan pembayaran hutang adalah proses membuat rencana untuk membayar kembali hutang-hutang yang dimiliki",0
233,"Hutang kartu kredit adalah bentuk hutang yang dikenakan bunga tinggi dan seringkali merupakan salah satu sumber utama masalah keuangan bagi individu. Banyak orang terjebak dalam siklus hutang kartu kredit karena pembayaran minimum yang rendah dan tingkat bunga yang tinggi. Untuk menghindari masalah dengan hutang kartu kredit, penting untuk membayar saldo penuh setiap bulan, menghindari pembelian impulsif, dan mencari kartu dengan tingkat bunga yang lebih rendah atau program imbalan yang menguntungkan.","Apa yang dimaksud dengan hutang kartu kredit?","Hutang kartu kredit adalah bentuk hutang yang dikenakan bunga tinggi dan seringkali merupakan salah satu sumber utama masalah keuangan bagi individu",0
234,"Pinjaman mahasiswa adalah bentuk hutang yang diperoleh untuk membiayai pendidikan tinggi. Sementara pinjaman mahasiswa dapat membantu siswa memperoleh gelar, mereka seringkali meninggalkan lulusan dengan beban hutang yang berat. Penting untuk memahami persyaratan pinjaman, tingkat bunga, dan opsi pembayaran sebelum mengambil pinjaman mahasiswa.","Apa yang dimaksud dengan pinjaman mahasiswa?","Pinjaman mahasiswa adalah bentuk hutang yang diperoleh untuk membiayai pendidikan tinggi",0
235,"Hutang hipotek adalah pinjaman yang dijamin oleh rumah atau properti lainnya. Ini adalah bentuk hutang jangka panjang yang digunakan untuk membeli atau memperbaiki rumah. Tingkat bunga pada hipotek dapat tetap atau dapat disesuaikan, tergantung pada jenis hipotek dan kondisi pasar keuangan. Pembayaran hipotek biasanya dilakukan secara bulanan selama periode waktu yang telah ditetapkan.","Apa yang dimaksud dengan hutang hipotek?","Hutang hipotek adalah pinjaman yang dijamin oleh rumah atau properti lainnya",0
236,"Hutang lancar adalah jenis hutang yang jatuh tempo dalam satu tahun atau siklus operasi normal perusahaan. Ini mencakup utang seperti hutang dagang, tagihan yang belum dibayar, atau pembayaran pajak yang belum dibayar. Hutang lancar adalah bagian penting dari analisis likuiditas perusahaan dan dapat mempengaruhi kemampuan perusahaan untuk memenuhi kewajiban keuangan tepat waktu.","Apa yang dimaksud dengan hutang lancar?","Hutang lancar adalah jenis hutang yang jatuh tempo dalam satu tahun atau siklus operasi normal perusahaan",0
237,"Hutang tetap adalah jenis hutang yang jatuh tempo dalam waktu lebih dari satu tahun atau siklus operasi normal perusahaan. Ini mencakup utang seperti obligasi, hipotek jangka panjang, atau pinjaman jangka panjang. Hutang tetap adalah bagian penting dari struktur modal perusahaan dan dapat mempengaruhi leverage dan kesehatan keuangan perusahaan.","Apa yang dimaksud dengan hutang tetap?","Hutang tetap adalah jenis hutang yang jatuh tempo dalam waktu lebih dari satu tahun atau siklus operasi normal perusahaan",0
238,"Hutang bersih adalah selisih antara total hutang dan total aset yang dimiliki oleh individu atau entitas. Ini memberikan gambaran tentang seberapa banyak hutang yang dimiliki seseorang atau perusahaan dibandingkan dengan aset yang mereka miliki. Hutang bersih yang tinggi dapat menandakan tingkat risiko yang tinggi, sementara hutang bersih yang rendah menunjukkan kekuatan keuangan.","Apa yang dimaksud dengan hutang bersih?","Hutang bersih adalah selisih antara total hutang dan total aset yang dimiliki oleh individu atau entitas",0
239,"Hutang berbunga adalah hutang yang dikenakan bunga atau biaya tambahan atas jumlah yang dipinjam. Bunga dapat dihitung sebagai persentase tertentu dari saldo hutang atau dapat ditentukan dalam jumlah tetap. Tingkat bunga pada hutang berbunga dapat bervariasi tergantung pada jenis hutang, profil risiko peminjam, dan kondisi pasar keuangan.","Apa yang dimaksud dengan hutang berbunga?","Hutang berbunga adalah hutang yang dikenakan bunga atau biaya tambahan atas jumlah yang dipinjam",0
240,"Hutang piutang adalah hutang yang timbul ketika individu atau perusahaan meminjam uang dari pihak lain, biasanya dengan janji untuk membayar kembali dalam jangka waktu tertentu. Ini mencakup hutang seperti pinjaman pribadi, kredit mobil, atau saldo kartu kredit. Hutang piutang dapat menjadi alat yang berguna untuk membiayai pembelian besar atau mendanai kebutuhan mendesak, tetapi harus dikelola dengan bijak untuk menghindari masalah keuangan di masa depan.","Apa yang dimaksud dengan hutang piutang?","Hutang piutang adalah hutang yang timbul ketika individu atau perusahaan meminjam uang dari pihak lain, biasanya dengan janji untuk membayar kembali dalam jangka waktu tertentu",0
241,"Hutang pajak adalah hutang yang timbul karena kewajiban pajak yang belum dibayar oleh individu atau entitas. Ini bisa berupa pajak penghasilan, pajak properti, atau pajak penjualan yang belum dibayar kepada pemerintah. Hutang pajak harus dibayar tepat waktu untuk menghindari denda dan sanksi yang mungkin diberikan oleh otoritas pajak.","Apa yang dimaksud dengan hutang pajak?","Hutang pajak adalah hutang yang timbul karena kewajiban pajak yang belum dibayar oleh individu atau entitas",0
242,"Hutang swasta adalah hutang yang dimiliki oleh individu atau entitas swasta, seperti perusahaan swasta atau individu. Ini berbeda dari hutang publik, yang dimiliki oleh pemerintah. Hutang swasta dapat meliputi pinjaman bisnis, pinjaman pribadi, atau hutang kartu kredit.","Apa yang dimaksud dengan hutang swasta?","Hutang swasta adalah hutang yang dimiliki oleh individu atau entitas swasta, seperti perusahaan swasta atau individu",0
243,"Bantuan masalah finansial adalah sumber dukungan dan bantuan yang tersedia bagi individu atau keluarga yang mengalami kesulitan keuangan. Ini dapat berupa bantuan keuangan langsung, konseling keuangan, atau program pendidikan keuangan untuk membantu individu mengelola keuangan mereka dengan lebih baik. Bantuan ini dapat diberikan oleh lembaga pemerintah, organisasi nirlaba, atau lembaga keuangan.","Apa yang dimaksud dengan bantuan masalah finansial?","Bantuan masalah finansial adalah sumber dukungan dan bantuan yang tersedia bagi individu atau keluarga yang mengalami kesulitan keuangan",0
244,"Lembaga pemerintah sering menyediakan bantuan finansial dalam bentuk program kesejahteraan sosial, subsidi perumahan, atau bantuan pendidikan. Program-program ini ditujukan untuk membantu individu atau keluarga yang berjuang secara finansial dan memenuhi syarat berdasarkan kriteria tertentu, seperti pendapatan atau status keluarga.","Bagaimana lembaga pemerintah membantu dalam masalah finansial?","Lembaga pemerintah sering menyediakan bantuan finansial dalam bentuk program kesejahteraan sosial, subsidi perumahan, atau bantuan pendidikan",0
245,"Organisasi nirlaba dan amal juga menyediakan bantuan finansial bagi mereka yang membutuhkan. Ini bisa berupa program bantuan makanan, bantuan tagihan utilitas, atau program bantuan darurat untuk membantu individu yang menghadapi situasi keuangan yang sulit. Organisasi nirlaba sering mengandalkan sumbangan dari masyarakat untuk mendanai program-program mereka.","Bagaimana organisasi nirlaba membantu dalam masalah finansial?","Organisasi nirlaba dan amal juga menyediakan bantuan finansial bagi mereka yang membutuhkan",0
246,"Konseling keuangan adalah layanan yang disediakan oleh profesional keuangan untuk membantu individu atau keluarga mengelola keuangan mereka dengan lebih baik. Ini melibatkan evaluasi situasi keuangan, pengembangan anggaran, perencanaan pembayaran hutang, dan pembuatan rencana keuangan jangka panjang. Konseling keuangan dapat dilakukan secara pribadi atau melalui lembaga pemerintah atau swasta.","Apa yang dimaksud dengan konseling keuangan?","Konseling keuangan adalah layanan yang disediakan oleh profesional keuangan untuk membantu individu atau keluarga mengelola keuangan mereka dengan lebih baik",0
247,"Program pendidikan keuangan adalah upaya untuk meningkatkan literasi keuangan dan memberikan pengetahuan tentang konsep keuangan dasar, seperti pengelolaan anggaran, investasi, atau pembayaran hutang. Program ini dapat diselenggarakan oleh lembaga pendidikan, lembaga keuangan, atau organisasi nirlaba sebagai bagian dari upaya untuk membantu individu mengembangkan keterampilan keuangan yang diperlukan untuk mengatasi masalah finansial.","Apa yang dimaksud dengan program pendidikan keuangan?","Program pendidikan keuangan adalah upaya untuk meningkatkan literasi keuangan dan memberikan pengetahuan tentang konsep keuangan dasar",0
248,"Bantuan masalah finansial dapat berupa bantuan keuangan langsung, seperti bantuan dalam membayar tagihan medis atau membayar sewa. Ini sering diberikan sebagai bantuan darurat bagi individu atau keluarga yang menghadapi situasi keuangan yang sulit dan tidak memiliki sumber daya untuk mengatasi masalah tersebut sendiri.","Apa yang dimaksud dengan bantuan keuangan langsung dalam masalah finansial?","Bantuan masalah finansial dapat berupa bantuan keuangan langsung, seperti bantuan dalam membayar tagihan medis atau membayar sewa",0
249,"Bantuan tagihan utilitas adalah bantuan yang diberikan kepada individu atau keluarga untuk membayar tagihan utilitas seperti listrik, air, atau gas. Program-program bantuan ini sering diselenggarakan oleh lembaga pemerintah atau organisasi nirlaba untuk membantu mereka yang kesulitan membayar tagihan utilitas bulanan.","Apa yang dimaksud dengan bantuan tagihan utilitas dalam masalah finansial?","Bantuan tagihan utilitas adalah bantuan yang diberikan kepada individu atau keluarga untuk membayar tagihan utilitas seperti listrik, air, atau gas",0
250,"Bantuan makanan adalah bantuan yang diberikan dalam bentuk makanan atau kupon makanan kepada individu atau keluarga yang menghadapi masalah keuangan dan kesulitan memenuhi kebutuhan makanan mereka. Program bantuan makanan sering dijalankan oleh lembaga amal atau pemerintah untuk membantu mengurangi kelaparan dan ketidakamanan pangan.","Apa yang dimaksud dengan bantuan makanan dalam masalah finansial?","Bantuan makanan adalah bantuan yang diberikan dalam bentuk makanan atau kupon makanan kepada individu atau keluarga yang menghadapi masalah keuangan",0
251,"Bantuan darurat adalah bantuan yang diberikan kepada individu atau keluarga dalam situasi keuangan yang mendesak, seperti bencana alam, kehilangan pekerjaan, atau masalah kesehatan yang tidak terduga. Ini dapat berupa bantuan keuangan langsung, bantuan tempat tinggal sementara, atau bantuan medis darurat untuk membantu individu mengatasi krisis finansial dengan lebih baik.","Apa yang dimaksud dengan bantuan darurat dalam masalah finansial?","Bantuan darurat adalah bantuan yang diberikan kepada individu atau keluarga dalam situasi keuangan yang mendesak, seperti bencana alam, kehilangan pekerjaan, atau masalah kesehatan yang tidak terduga",0
252,"Bantuan masalah finansial adalah sumber dukungan yang disediakan bagi individu atau keluarga yang menghadapi kesulitan keuangan. Ini bisa berupa bantuan keuangan langsung, program konseling keuangan, atau program pendidikan keuangan. Organisasi pemerintah, nirlaba, dan swasta sering menawarkan bantuan ini untuk membantu individu mengatasi kesulitan finansial.","Bagaimana cara mendapatkan bantuan masalah finansial?","Organisasi pemerintah, nirlaba, dan swasta sering menawarkan bantuan ini untuk membantu individu mengatasi kesulitan finansial",0
253,"Bantuan keuangan langsung adalah salah satu bentuk bantuan masalah finansial yang paling umum. Ini bisa berupa bantuan untuk membayar tagihan medis, sewa, atau tagihan utilitas. Untuk mendapatkan bantuan keuangan langsung, individu biasanya perlu mengajukan permohonan ke lembaga yang menyelenggarakan program bantuan tersebut dan memenuhi syarat berdasarkan kriteria tertentu.","Bagaimana cara mendapatkan bantuan keuangan langsung?","Untuk mendapatkan bantuan keuangan langsung, individu biasanya perlu mengajukan permohonan ke lembaga yang menyelenggarakan program bantuan tersebut dan memenuhi syarat berdasarkan kriteria tertentu",0
254,"Bantuan kesehatan adalah berupa bantuan yang diberikan kepada individu atau keluarga untuk membayar biaya kesehatan yang tidak terjangkau. Ini dapat mencakup bantuan untuk biaya pengobatan, obat-obatan, atau perawatan medis yang diperlukan. Program-program bantuan kesehatan ini sering diselenggarakan oleh lembaga pemerintah atau organisasi kesehatan untuk membantu individu yang tidak memiliki asuransi kesehatan atau tidak mampu membayar biaya kesehatan yang tinggi.","Apa yang dimaksud dengan bantuan kesehatan dalam masalah finansial?","Bantuan kesehatan adalah bantuan yang diberikan kepada individu atau keluarga untuk membayar biaya kesehatan yang tidak terjangkau",0
255,"Bantuan pendidikan adalah bantuan yang diberikan kepada individu untuk membayar biaya pendidikan, seperti uang sekolah, buku, atau perlengkapan pendidikan lainnya. Ini dapat mencakup beasiswa, hibah pendidikan, atau pinjaman pendidikan dengan tingkat bunga yang rendah. Program-program bantuan pendidikan ini bertujuan untuk membantu individu memperoleh pendidikan yang lebih tinggi dan meningkatkan mobilitas sosial.","Apa yang dimaksud dengan bantuan pendidikan dalam masalah finansial?","Bantuan pendidikan adalah bantuan yang diberikan kepada individu untuk membayar biaya pendidikan, seperti uang sekolah, buku, atau perlengkapan pendidikan lainnya",0
256,"Bantuan tempat tinggal adalah bantuan yang diberikan kepada individu atau keluarga untuk membayar biaya tempat tinggal, seperti sewa atau pembayaran hipotek. Ini dapat berupa bantuan keuangan langsung, subsidi perumahan, atau program penempatan kembali untuk membantu individu yang menghadapi masalah tempat tinggal atau ancaman kehilangan tempat tinggal.","Apa yang dimaksud dengan bantuan tempat tinggal dalam masalah finansial?","Bantuan tempat tinggal adalah bantuan yang diberikan kepada individu atau keluarga untuk membayar biaya tempat tinggal, seperti sewa atau pembayaran hipotek",0
257,"Bantuan pekerjaan adalah bantuan yang diberikan kepada individu dalam mencari atau mempertahankan pekerjaan. Ini dapat mencakup pelatihan keterampilan, penempatan kerja, atau bantuan dalam mencari pekerjaan. Program-program bantuan pekerjaan ini bertujuan untuk membantu individu meningkatkan kemampuan kerja mereka dan mendapatkan pendapatan yang stabil.","Apa yang dimaksud dengan bantuan pekerjaan dalam masalah finansial?","Bantuan pekerjaan adalah bantuan yang diberikan kepada individu dalam mencari atau mempertahankan pekerjaan",0
