id,context,question,answer,answer_start
307,"Hutang adalah uang yang dipinjam oleh individu, bisnis, atau pemerintah yang harus dibayar kembali dengan bunga. Hutang dapat berupa pinjaman pribadi, hipotek, obligasi, atau kartu kredit. Manajemen hutang yang baik penting untuk menjaga kesehatan keuangan dan mencegah masalah keuangan di masa depan.","Apa itu hutang?","Hutang adalah uang yang dipinjam oleh individu, bisnis, atau pemerintah yang harus dibayar kembali dengan bunga",0
308,"Pinjaman pribadi adalah jenis hutang di mana individu meminjam uang dari bank, kreditur, atau lembaga keuangan lainnya untuk keperluan pribadi. Pinjaman pribadi biasanya diberikan berdasarkan kredit dan kemampuan pembayaran peminjam. Pembayaran dilakukan dalam bentuk cicilan tetap selama periode waktu tertentu.","Apa itu pinjaman pribadi?","Pinjaman pribadi adalah jenis hutang di mana individu meminjam uang dari bank, kreditur, atau lembaga keuangan lainnya untuk keperluan pribadi",0
309,"Hipotek adalah jenis hutang yang dijamin oleh properti atau aset lainnya. Hipotek biasanya digunakan untuk membeli rumah, di mana rumah tersebut dijadikan jaminan untuk pinjaman. Jika peminjam gagal membayar pinjaman, pemberi pinjaman memiliki hak untuk mengambil alih properti dan menjualnya untuk melunasi hutang.","Apa itu hipotek?","Hipotek adalah jenis hutang yang dijamin oleh properti atau aset lainnya",0
310,"Kartu kredit adalah alat pembayaran yang memungkinkan pemegang kartu untuk membeli barang dan jasa dengan menggunakan kredit yang diberikan oleh penerbit kartu. Kartu kredit memungkinkan pembayaran yang fleksibel dengan pembayaran minimum bulanan, tetapi juga dapat mengakibatkan hutang tinggi jika tidak dikelola dengan baik.","Apa itu kartu kredit?","Kartu kredit adalah alat pembayaran yang memungkinkan pemegang kartu untuk membeli barang dan jasa dengan menggunakan kredit yang diberikan oleh penerbit kartu",0
311,"Kreditur adalah pihak yang memberikan hutang kepada individu, bisnis, atau pemerintah. Kreditur dapat berupa bank, lembaga keuangan, atau individu lain yang memberikan pinjaman dengan harapan untuk menerima pembayaran kembali dengan bunga. Kreditur memiliki hak untuk menagih hutang jika peminjam gagal membayar tepat waktu.","Apa itu kreditur?","Kreditur adalah pihak yang memberikan hutang kepada individu, bisnis, atau pemerintah",0
312,"Jaminan adalah aset yang digunakan untuk menjamin pembayaran hutang. Jaminan dapat berupa properti, kendaraan, atau aset lain yang memiliki nilai. Jaminan memberikan keamanan kepada pemberi pinjaman bahwa hutang akan dilunasi, karena pemberi pinjaman dapat menjual jaminan jika peminjam gagal membayar hutangnya.","Apa itu jaminan dalam konteks hutang?","Jaminan adalah aset yang digunakan untuk menjamin pembayaran hutang",0
313,"Perusahaan sering menggunakan obligasi sebagai cara untuk meminjam dana dari investor. Obligasi adalah surat utang yang diterbitkan oleh perusahaan atau pemerintah untuk mengumpulkan dana, dengan janji untuk membayar kembali jumlah pokok beserta bunga pada tanggal jatuh tempo tertentu. Obligasi dapat diperdagangkan di pasar sekunder.","Apa itu obligasi?","Obligasi adalah surat utang yang diterbitkan oleh perusahaan atau pemerintah untuk mengumpulkan dana",0
314,"Konsolidasi hutang adalah proses menggabungkan beberapa hutang menjadi satu pinjaman yang lebih besar. Tujuannya adalah untuk mengurangi pembayaran bulanan dengan suku bunga yang lebih rendah atau jangka waktu yang lebih lama. Konsolidasi hutang dapat dilakukan melalui pinjaman konsolidasi, transfer saldo, atau program penyelesaian hutang.","Apa itu konsolidasi hutang?","Konsolidasi hutang adalah proses menggabungkan beberapa hutang menjadi satu pinjaman yang lebih besar",0
315,"Penundaan pembayaran adalah situasi di mana peminjam meminta penundaan pembayaran atau pembayaran minimum yang lebih rendah pada pinjaman. Penundaan pembayaran biasanya diizinkan oleh pemberi pinjaman dalam situasi keuangan yang sulit, tetapi dapat menyebabkan biaya tambahan atau bunga yang lebih tinggi di masa depan.","Apa itu penundaan pembayaran dalam konteks hutang?","Penundaan pembayaran adalah situasi di mana peminjam meminta penundaan pembayaran atau pembayaran minimum yang lebih rendah pada pinjaman",0
316,"Hutang yang tidak dibayar dapat mengakibatkan konsekuensi serius, termasuk penarikan aset jaminan, penutupan akun, atau tindakan hukum. Jatuh tempo pembayaran dapat mengakibatkan denda keterlambatan atau peningkatan suku bunga. Kreditur juga dapat menggunakan agen penagih hutang atau melaporkan hutang yang tidak dibayar ke agen pelaporan kredit.","Apa konsekuensi dari hutang yang tidak dibayar?","Hutang yang tidak dibayar dapat mengakibatkan konsekuensi serius, termasuk penarikan aset jaminan, penutupan akun, atau tindakan hukum",0
317,"Reksadana adalah wadah investasi yang mengumpulkan dana dari banyak investor untuk diinvestasikan dalam berbagai instrumen keuangan seperti saham, obligasi, atau pasar uang. Manajer investasi mengelola dana tersebut dan bertujuan untuk mencapai pertumbuhan investasi yang optimal sesuai dengan tujuan reksadana.","Apa itu reksadana?","Reksadana adalah wadah investasi yang mengumpulkan dana dari banyak investor untuk diinvestasikan dalam berbagai instrumen keuangan seperti saham, obligasi, atau pasar uang",0
318,"Investor dalam reksadana memiliki kepemilikan proporsional dalam portofolio investasi reksadana. Keuntungan dan kerugian dari investasi tersebut dibagi antara investor sesuai dengan jumlah saham yang mereka miliki. Reksadana memungkinkan investor dengan modal terbatas untuk mendiversifikasi portofolio mereka secara efisien.","Bagaimana kepemilikan dalam reksadana dihitung?","Investor dalam reksadana memiliki kepemilikan proporsional dalam portofolio investasi reksadana",0
319,"Manajer investasi adalah individu atau perusahaan yang bertanggung jawab untuk mengelola dana dalam reksadana. Tugas utama manajer investasi adalah membuat keputusan investasi yang cerdas untuk mencapai tujuan investasi reksadana dan memaksimalkan pengembalian bagi investor.","Apa peran manajer investasi dalam reksadana?","Manajer investasi adalah individu atau perusahaan yang bertanggung jawab untuk mengelola dana dalam reksadana",0
320,"Biaya reksadana meliputi biaya manajemen, biaya penjualan, dan biaya administrasi. Biaya manajemen dibayarkan kepada manajer investasi untuk mengelola portofolio reksadana, sementara biaya penjualan dapat termasuk biaya penjualan awal atau biaya penjualan kembali. Biaya administrasi mencakup biaya operasional harian reksadana.","Apa saja biaya yang terkait dengan reksadana?","Biaya reksadana meliputi biaya manajemen, biaya penjualan, dan biaya administrasi",0
321,"Imbal hasil adalah tingkat pengembalian yang diperoleh dari investasi dalam reksadana. Ini dapat diukur sebagai persentase pertumbuhan harga unit reksadana atau sebagai tingkat dividen yang dibayarkan kepada pemegang saham. Imbal hasil yang baik menunjukkan kinerja investasi yang solid dari reksadana.","Apa yang dimaksud dengan imbal hasil dalam reksadana?","Imbal hasil adalah tingkat pengembalian yang diperoleh dari investasi dalam reksadana",0
322,"Reksadana saham adalah reksadana yang menginvestasikan sebagian besar dana dalam saham perusahaan. Tujuan dari reksadana saham adalah untuk mencapai pertumbuhan modal jangka panjang. Reksadana saham cocok untuk investor dengan toleransi risiko yang tinggi dan tujuan investasi jangka panjang.","Apa itu reksadana saham?","Reksadana saham adalah reksadana yang menginvestasikan sebagian besar dana dalam saham perusahaan",0
323,"Reksadana obligasi adalah reksadana yang menginvestasikan sebagian besar dana dalam obligasi pemerintah atau perusahaan. Tujuan dari reksadana obligasi adalah untuk menghasilkan pendapatan tetap dan melindungi modal investor. Reksadana obligasi cocok untuk investor dengan profil risiko yang lebih rendah dan tujuan investasi pendapatan tetap.","Apa itu reksadana obligasi?","Reksadana obligasi adalah reksadana yang menginvestasikan sebagian besar dana dalam obligasi pemerintah atau perusahaan",0
324,"Reksadana pasar uang adalah reksadana yang menginvestasikan dana dalam instrumen pasar uang seperti deposito berjangka, surat berharga pasar uang, atau obligasi jangka pendek. Tujuan dari reksadana pasar uang adalah untuk mempertahankan modal dan memberikan likuiditas tinggi. Reksadana pasar uang cocok untuk investor dengan profil risiko rendah dan tujuan investasi jangka pendek.","Apa itu reksadana pasar uang?","Reksadana pasar uang adalah reksadana yang menginvestasikan dana dalam instrumen pasar uang seperti deposito berjangka, surat berharga pasar uang, atau obligasi jangka pendek",0
325,"Uang adalah alat tukar yang diterima secara umum untuk barang dan jasa serta untuk pembayaran utang. Fungsi utama uang adalah sebagai medium pertukaran yang memfasilitasi perdagangan dan memudahkan pembayaran. Uang dapat berbentuk kertas, logam, atau digital.","Apa definisi uang?","Uang adalah alat tukar yang diterima secara umum untuk barang dan jasa serta untuk pembayaran utang",0
326,"Sejarah uang dapat ditelusuri kembali ke zaman prasejarah ketika sistem barter digunakan untuk pertukaran barang. Uang sebagai medium pertukaran diperkenalkan untuk mengatasi kelemahan sistem barter, memfasilitasi perdagangan, dan meningkatkan efisiensi ekonomi.","Apa sejarah uang?","Sejarah uang dapat ditelusuri kembali ke zaman prasejarah ketika sistem barter digunakan untuk pertukaran barang",0
327,"Uang kertas adalah bentuk uang yang terdiri dari kertas atau plastik dan memiliki nilai yang ditentukan oleh pemerintah atau otoritas moneter. Uang kertas digunakan secara luas untuk transaksi sehari-hari dan memfasilitasi perdagangan. Contoh uang kertas termasuk dolar, euro, dan yen.","Apa itu uang kertas?","Uang kertas adalah bentuk uang yang terdiri dari kertas atau plastik dan memiliki nilai yang ditentukan oleh pemerintah atau otoritas moneter",0
328,"Koin adalah bentuk uang logam yang digunakan untuk transaksi sehari-hari. Koin memiliki nilai intrinsik yang terbuat dari logam dan dicetak dengan denominasi tertentu. Koin digunakan untuk memberikan kembalian, memfasilitasi transaksi kecil, dan sebagai alat pembayaran alternatif.","Apa itu koin?","Koin adalah bentuk uang logam yang digunakan untuk transaksi sehari-hari",0
329,"Uang digital adalah bentuk uang yang ada dalam bentuk digital atau elektronik dan disimpan dalam sistem komputer atau jaringan. Uang digital memungkinkan pembayaran dan transfer dana melalui internet atau perangkat elektronik seperti ponsel cerdas atau komputer. Contoh uang digital termasuk kriptokurensi seperti Bitcoin dan Ethereum.","Apa itu uang digital?","Uang digital adalah bentuk uang yang ada dalam bentuk digital atau elektronik dan disimpan dalam sistem komputer atau jaringan",0
330,"Inflasi adalah peningkatan umum dalam harga barang dan jasa dari waktu ke waktu, yang mengurangi daya beli uang. Inflasi terjadi ketika jumlah uang beredar meningkat lebih cepat daripada peningkatan barang dan jasa yang diproduksi. Inflasi dapat diukur dengan indeks harga konsumen (IHK), yang membandingkan harga barang dan jasa dari periode waktu tertentu.","Apa itu inflasi?","Inflasi adalah peningkatan umum dalam harga barang dan jasa dari waktu ke waktu, yang mengurangi daya beli uang",0
331,"Deflasi adalah penurunan umum dalam harga barang dan jasa dari waktu ke waktu, yang meningkatkan daya beli uang. Deflasi dapat terjadi karena peningkatan produksi barang dan jasa yang lebih cepat daripada pertumbuhan jumlah uang beredar. Deflasi dapat menyebabkan penundaan pembelian konsumen dan investasi karena harapan harga yang lebih rendah di masa depan.","Apa itu deflasi?","Deflasi adalah penurunan umum dalam harga barang dan jasa dari waktu ke waktu, yang meningkatkan daya beli uang",0
332,"Siklus bisnis adalah fluktuasi ekonomi periodik yang terdiri dari ekspansi, puncak, kontraksi, dan dasar. Siklus bisnis mencerminkan perubahan dalam kegiatan ekonomi dan pertumbuhan output suatu negara dari waktu ke waktu. Siklus bisnis dipengaruhi oleh berbagai faktor termasuk permintaan konsumen, investasi, dan kebijakan moneter.","Apa itu siklus bisnis?","Siklus bisnis adalah fluktuasi ekonomi periodik yang terdiri dari ekspansi, puncak, kontraksi, dan dasar",0
333,"Mengelola uang adalah proses penting dalam kehidupan sehari-hari yang melibatkan pengelolaan pendapatan, pengeluaran, investasi, dan tabungan dengan bijaksana. Langkah-langkah untuk mengelola uang termasuk membuat anggaran, melacak pengeluaran, menabung secara teratur, dan berinvestasi sesuai dengan tujuan keuangan. Praktik pengelolaan uang yang baik dapat membantu seseorang mencapai stabilitas keuangan, mengurangi stres keuangan, dan mencapai tujuan keuangan jangka panjang.","Apa itu mengelola uang?","Mengelola uang adalah proses penting dalam kehidupan sehari-hari yang melibatkan pengelolaan pendapatan, pengeluaran, investasi, dan tabungan dengan bijaksana",0
334,"Membuat anggaran adalah langkah awal dalam mengelola uang dengan baik. Anggaran membantu seseorang untuk menetapkan tujuan keuangan, mengidentifikasi sumber pendapatan dan pengeluaran, serta mengalokasikan uang dengan bijaksana untuk mencapai tujuan tersebut. Anggaran juga membantu untuk menghindari pengeluaran yang tidak perlu dan memastikan keseimbangan antara pendapatan dan pengeluaran.","Apa pentingnya membuat anggaran dalam mengelola uang?","Membuat anggaran adalah langkah awal dalam mengelola uang dengan baik. Anggaran membantu seseorang untuk menetapkan tujuan keuangan, mengidentifikasi sumber pendapatan dan pengeluaran, serta mengalokasikan uang dengan bijaksana untuk mencapai tujuan tersebut",0
335,"Melacak pengeluaran adalah bagian penting dari mengelola uang. Dengan melacak pengeluaran, seseorang dapat memahami di mana uang mereka benar-benar digunakan dan mengidentifikasi area di mana mereka bisa menghemat. Ada berbagai alat dan aplikasi yang tersedia untuk membantu melacak pengeluaran, mulai dari spreadsheet hingga aplikasi keuangan pribadi yang canggih.","Mengapa melacak pengeluaran penting dalam mengelola uang?","Melacak pengeluaran adalah bagian penting dari mengelola uang. Dengan melacak pengeluaran, seseorang dapat memahami di mana uang mereka benar-benar digunakan dan mengidentifikasi area di mana mereka bisa menghemat",0
336,"Menabung secara teratur adalah kebiasaan keuangan yang penting dalam mengelola uang. Menabung membantu seseorang membangun cadangan dana darurat, merencanakan untuk kebutuhan mendesak, dan mencapai tujuan keuangan jangka panjang seperti membeli rumah atau pensiun. Menabung secara teratur juga membantu dalam membangun disiplin keuangan dan mengurangi kecemasan finansial di masa depan.","Mengapa menabung secara teratur penting dalam mengelola uang?","Menabung secara teratur adalah kebiasaan keuangan yang penting dalam mengelola uang. Menabung membantu seseorang membangun cadangan dana darurat, merencanakan untuk kebutuhan mendesak, dan mencapai tujuan keuangan jangka panjang seperti membeli rumah atau pensiun",0
337,"Investasi adalah strategi penting dalam mengelola uang untuk mencapai tujuan keuangan jangka panjang. Investasi dapat membantu seseorang memperoleh pengembalian yang lebih tinggi dari tabungan tradisional, tetapi juga melibatkan risiko. Penting untuk melakukan riset yang cermat sebelum berinvestasi, memahami profil risiko dan tujuan investasi, dan mempertimbangkan diversifikasi portofolio untuk mengurangi risiko.","Mengapa investasi penting dalam mengelola uang?","Investasi adalah strategi penting dalam mengelola uang untuk mencapai tujuan keuangan jangka panjang",0
338,"Merencanakan untuk pensiun adalah bagian penting dari mengelola uang. Pensiun adalah tahap hidup di mana seseorang berhenti bekerja dan mulai bergantung pada tabungan dan investasi untuk memenuhi kebutuhan keuangan mereka. Dengan merencanakan untuk pensiun secara dini dan berinvestasi secara bijaksana, seseorang dapat memastikan kestabilan keuangan dan kenyamanan di masa pensiun.","Mengapa merencanakan untuk pensiun penting dalam mengelola uang?","Merencanakan untuk pensiun adalah bagian penting dari mengelola uang. Pensiun adalah tahap hidup di mana seseorang berhenti bekerja dan mulai bergantung pada tabungan dan investasi untuk memenuhi kebutuhan keuangan mereka",0
339,"Memiliki dana darurat adalah elemen kunci dari mengelola uang dengan baik. Dana darurat adalah tabungan yang disediakan untuk mengatasi keadaan darurat finansial yang tak terduga, seperti kehilangan pekerjaan, biaya medis tak terduga, atau perbaikan rumah mendesak. Dana darurat harus cukup untuk menutupi biaya hidup minimal selama beberapa bulan tanpa penghasilan.","Mengapa memiliki dana darurat penting dalam mengelola uang?","Memiliki dana darurat adalah elemen kunci dari mengelola uang dengan baik",0
340,"Mengurangi utang adalah langkah penting dalam mengelola uang. Utang yang berlebihan dapat menjadi beban keuangan yang berat dan menghambat kemajuan keuangan. Cara-cara untuk mengurangi utang termasuk membayar utang dengan bunga tinggi terlebih dahulu, membuat rencana pembayaran utang yang teratur, dan mencari cara untuk meningkatkan pendapatan atau mengurangi pengeluaran guna membayar utang lebih cepat.","Mengapa mengurangi utang penting dalam mengelola uang?","Mengurangi utang adalah langkah penting dalam mengelola uang",0
341,"Perencanaan keuangan adalah proses mengidentifikasi tujuan keuangan, mengevaluasi sumber daya keuangan, dan mengembangkan rencana untuk mencapai tujuan tersebut. Ini melibatkan membuat anggaran, mengelola utang, menabung, berinvestasi, dan merencanakan untuk pensiun. Perencanaan keuangan membantu individu dan keluarga mengelola uang mereka dengan lebih efektif, mengurangi stres keuangan, dan mencapai keamanan finansial di masa depan.","Apa yang dimaksud dengan perencanaan keuangan?","Perencanaan keuangan adalah proses mengidentifikasi tujuan keuangan, mengevaluasi sumber daya keuangan, dan mengembangkan rencana untuk mencapai tujuan tersebut",0
342,"Diversifikasi portofolio adalah strategi investasi yang melibatkan alokasi dana ke berbagai kelas aset untuk mengurangi risiko investasi. Dengan memiliki beragam investasi dalam portofolio, kerugian pada satu investasi dapat ditutupi oleh kinerja positif pada yang lain. Diversifikasi portofolio dapat dicapai dengan berinvestasi dalam saham, obligasi, real estat, dan instrumen keuangan lainnya.","Apa itu diversifikasi portofolio?","Diversifikasi portofolio adalah strategi investasi yang melibatkan alokasi dana ke berbagai kelas aset untuk mengurangi risiko investasi",0
343,"Pendidikan keuangan adalah proses memberikan pengetahuan dan keterampilan keuangan kepada individu sehingga mereka dapat mengelola uang mereka dengan bijaksana. Ini melibatkan pembelajaran tentang topik seperti pembuatan anggaran, manajemen utang, investasi, tabungan, dan perencanaan pensiun. Pendidikan keuangan membantu meningkatkan literasi keuangan, mengurangi perilaku keuangan yang merugikan, dan meningkatkan kemampuan individu untuk mengambil keputusan keuangan yang baik.","Apa itu pendidikan keuangan?","Pendidikan keuangan adalah proses memberikan pengetahuan dan keterampilan keuangan kepada individu sehingga mereka dapat mengelola uang mereka dengan bijaksana",0
344,"Rencana pensiun adalah strategi keuangan yang mengatur tabungan dan investasi untuk memastikan pendapatan yang mencukupi setelah pensiun. Rencana pensiun dapat mencakup kontribusi ke rencana pensiun perusahaan, IRA (Individual Retirement Account), 401(k), atau jenis akun pensiun lainnya. Merencanakan untuk pensiun secara dini memungkinkan seseorang untuk memanfaatkan bunga majemuk dan membangun kekayaan yang cukup untuk pensiun yang nyaman.","Apa yang dimaksud dengan rencana pensiun?","Rencana pensiun adalah strategi keuangan yang mengatur tabungan dan investasi untuk memastikan pendapatan yang mencukupi setelah pensiun",0
345,"Manajemen risiko keuangan adalah proses mengidentifikasi, mengevaluasi, dan mengelola risiko keuangan yang mungkin dihadapi oleh individu, keluarga, atau organisasi. Ini melibatkan pembuatan keputusan untuk mengurangi atau mentransfer risiko keuangan, seperti asuransi, diversifikasi investasi, atau pembuatan cadangan dana darurat. Manajemen risiko keuangan membantu melindungi kekayaan dan kestabilan keuangan dari peristiwa tak terduga seperti kehilangan pendapatan atau biaya medis besar.","Apa yang dimaksud dengan manajemen risiko keuangan?","Manajemen risiko keuangan adalah proses mengidentifikasi, mengevaluasi, dan mengelola risiko keuangan yang mungkin dihadapi oleh individu, keluarga, atau organisasi",0
346,"Kepemilikan rumah adalah salah satu aset penting dalam strategi keuangan banyak orang. Memiliki rumah dapat memberikan keamanan tempat tinggal, meningkatkan kekayaan melalui apresiasi nilai properti, dan memberikan manfaat pajak tertentu. Namun, membeli rumah juga melibatkan biaya besar termasuk uang muka, hipotek, dan biaya pemeliharaan, sehingga penting untuk mempertimbangkan kesiapan keuangan sebelum memutuskan untuk membeli rumah.","Apa yang dimaksud dengan kepemilikan rumah dalam konteks keuangan?","Kepemilikan rumah adalah salah satu aset penting dalam strategi keuangan banyak orang",0
347,"Asuransi adalah produk keuangan yang memberikan perlindungan finansial kepada individu atau organisasi dalam pertukaran atas pembayaran premi. Asuransi melindungi pemegang polis dari kerugian finansial yang disebabkan oleh peristiwa tak terduga, seperti kecelakaan, penyakit, atau kematian. Jenis asuransi termasuk asuransi kesehatan, asuransi jiwa, asuransi properti, dan asuransi kendaraan bermotor.","Apa yang dimaksud dengan asuransi dalam konteks keuangan?","Asuransi adalah produk keuangan yang memberikan perlindungan finansial kepada individu atau organisasi dalam pertukaran atas pembayaran premi",0
348,"Pembiayaan pendidikan adalah investasi dalam pendidikan seseorang melalui pinjaman, beasiswa, atau tabungan pendidikan. Ini melibatkan pembayaran biaya pendidikan seperti uang kuliah, buku, dan biaya hidup. Meskipun biaya pendidikan bisa mahal, pendidikan yang baik dapat membuka pintu untuk kesempatan karir yang lebih baik dan meningkatkan potensi pendapatan di masa depan.","Apa yang dimaksud dengan pembiayaan pendidikan dalam konteks keuangan?","Pembiayaan pendidikan adalah investasi dalam pendidikan seseorang melalui pinjaman, beasiswa, atau tabungan pendidikan",0
349,"Konservasi energi adalah praktik mengurangi penggunaan energi dengan cara efisien untuk menghemat sumber daya alam dan mengurangi dampak lingkungan. Ini melibatkan mengadopsi kebiasaan sehari-hari yang mengurangi konsumsi energi, seperti mematikan lampu saat tidak digunakan, memanfaatkan energi terbarukan, dan menggunakan perangkat hemat energi. Konservasi energi juga dapat membantu menghemat uang dengan mengurangi tagihan energi listrik dan bahan bakar.","Apa yang dimaksud dengan konservasi energi dalam konteks pengelolaan uang?","Konservasi energi adalah praktik mengurangi penggunaan energi dengan cara efisien untuk menghemat sumber daya alam dan mengurangi dampak lingkungan",0
350,"Harga adalah jumlah uang yang harus dibayarkan untuk memperoleh barang atau jasa. Harga dipengaruhi oleh berbagai faktor termasuk biaya produksi, permintaan pasar, dan persaingan. Mengelola harga adalah penting dalam pengelolaan uang karena membantu individu dan bisnis mengontrol pengeluaran mereka, membandingkan nilai dari berbagai produk atau layanan, dan membuat keputusan pembelian yang cerdas.","Apa yang dimaksud dengan mengelola harga dalam konteks pengelolaan uang?","Harga adalah jumlah uang yang harus dibayarkan untuk memperoleh barang atau jasa",0
351,"Budaya menabung adalah praktik menyimpan uang secara teratur untuk tujuan masa depan, seperti dana darurat, pendidikan, atau pensiun. Menabung adalah bagian penting dari pengelolaan uang yang bijaksana karena membantu individu dan keluarga membangun kekayaan, merencanakan untuk kebutuhan mendesak, dan mencapai tujuan keuangan jangka panjang. Budaya menabung juga dapat membantu melindungi dari situasi keuangan yang sulit, seperti kehilangan pekerjaan atau biaya medis tak terduga.","Apa yang dimaksud dengan budaya menabung dalam pengelolaan uang?","Budaya menabung adalah praktik menyimpan uang secara teratur untuk tujuan masa depan, seperti dana darurat, pendidikan, atau pensiun",0
352,"Pertumbuhan ekonomi adalah peningkatan nilai output ekonomi suatu negara dari waktu ke waktu. Ini dapat diukur dengan pertumbuhan Produk Domestik Bruto (PDB), yang merupakan nilai total barang dan jasa yang dihasilkan dalam suatu negara selama periode waktu tertentu. Mengelola pertumbuhan ekonomi adalah penting dalam pengelolaan uang karena pertumbuhan ekonomi yang stabil dapat memberikan kesempatan untuk penghasilan yang lebih tinggi, lapangan kerja yang lebih banyak, dan kesejahteraan yang lebih besar bagi masyarakat.","Apa yang dimaksud dengan mengelola pertumbuhan ekonomi dalam konteks pengelolaan uang?","Pertumbuhan ekonomi adalah peningkatan nilai output ekonomi suatu negara dari waktu ke waktu",0
353,"Faktor risiko adalah kondisi atau peristiwa yang dapat menyebabkan kerugian atau kerugian finansial bagi individu, bisnis, atau investasi. Faktor risiko dapat bervariasi tergantung pada konteksnya dan dapat mencakup risiko pasar, risiko kredit, risiko operasional, dan lain-lain. Mengelola risiko adalah penting dalam pengelolaan uang karena membantu melindungi kekayaan dan kestabilan keuangan dari kerugian yang tidak diinginkan.","Apa yang dimaksud dengan faktor risiko dalam pengelolaan uang?","Faktor risiko adalah kondisi atau peristiwa yang dapat menyebabkan kerugian atau kerugian finansial bagi individu, bisnis, atau investasi",0
