id,context,question,answer,answer_start
1,"pengelola keuangan yang baik","Apa itu pengelolaan keuangan yang baik?","Pengelolaan keuangan yang baik adalah proses mengelola pendapatan, pengeluaran, dan investasi dengan bijak untuk mencapai tujuan keuangan jangka pendek dan jangka panjang. Ini termasuk membuat anggaran, menabung, berinvestasi, dan melunasi utang secara efektif",0
2,"anggaran bulanan","Bagaimana cara membuat anggaran bulanan?","Cara membuat anggaran bulanan adalah dengan mencatat semua sumber pendapatan dan mengkategorikan semua pengeluaran menjadi kebutuhan dan keinginan. Prioritaskan kebutuhan seperti makanan, tempat tinggal, dan transportasi, dan sisihkan sebagian pendapatan untuk tabungan dan investasi",0
3,"melunasi utang","Bagaimana cara melunasi utang dengan cepat?","Cara melunasi utang dengan cepat termasuk membuat daftar semua utang, fokus pada melunasi utang dengan bunga tertinggi terlebih dahulu, mengurangi pengeluaran yang tidak perlu, dan mungkin mencari sumber pendapatan tambahan untuk mempercepat pelunasan utang",0
4,"risiko investasi","Bagaimana cara menilai risiko dalam investasi?","Menilai risiko dalam investasi melibatkan memahami faktor-faktor yang bisa mempengaruhi nilai investasi Anda, seperti kondisi pasar, inflasi, dan kinerja perusahaan. Diversifikasi portofolio Anda dengan berbagai jenis investasi juga bisa membantu mengurangi risiko",0
5,"memulai investasi","Bagaimana cara memulai investasi dengan modal kecil?","Memulai investasi dengan modal kecil bisa dilakukan dengan membuka rekening investasi yang memungkinkan pembelian sebagian saham, menggunakan aplikasi investasi mikro, atau memilih reksa dana yang memiliki minimum investasi rendah",0
6,"asuransi kesehatan","Apa keuntungan memiliki asuransi kesehatan?","Keuntungan memiliki asuransi kesehatan termasuk perlindungan finansial dari biaya pengobatan yang tinggi, akses ke layanan kesehatan yang lebih baik, dan ketenangan pikiran karena mengetahui bahwa Anda dilindungi dalam keadaan darurat medis",0
7,"rasio utang terhadap pendapatan","Apa itu rasio utang terhadap pendapatan?","Rasio utang terhadap pendapatan adalah perbandingan antara total utang seseorang dengan total pendapatan mereka. Rasio ini digunakan untuk menilai kemampuan seseorang dalam mengelola dan melunasi utang mereka",0
8,"kebebasan financial/ financial freedom","Bagaimana cara mencapai kebebasan finansial?","Mencapai kebebasan finansial melibatkan mengelola keuangan dengan bijak, menabung dan berinvestasi secara konsisten, mengurangi atau melunasi utang, dan membangun sumber-sumber pendapatan pasif yang dapat mendukung gaya hidup Anda tanpa perlu bekerja aktif",0
8,"mengatur keuangan untuk melunasi utang","Bagaimana cara mengatur keuangan untuk melunasi utang?","Mengatur keuangan untuk melunasi utang melibatkan membuat anggaran yang jelas, mengurangi pengeluaran yang tidak perlu, mengalokasikan dana tambahan untuk pembayaran utang, dan mungkin mencari pendapatan tambahan. Fokus pada melunasi utang dengan bunga tertinggi terlebih dahulu untuk mengurangi beban bunga keseluruhan.",0
9,"mengelola kartu kredit dengan baik","Bagaimana cara menggunakan kartu kredit dengan bijak?","Menggunakan kartu kredit dengan bijak melibatkan membayar saldo penuh setiap bulan untuk menghindari bunga, hanya menggunakan kartu kredit untuk pembelian yang bisa Anda bayar, dan memanfaatkan rewards atau cashback yang ditawarkan. Hindari penggunaan kartu kredit untuk pembelian impulsif.",0
11,"membeli rumah dengan sistem KPR","Bagaimana cara mengelola KPR rumah dengan baik?","Mengelola KPR rumah dengan baik termasuk membuat anggaran yang memasukkan pembayaran KPR sebagai prioritas, mempertimbangkan pelunasan lebih cepat jika memungkinkan untuk mengurangi total bunga, dan memastikan Anda memiliki asuransi properti yang memadai untuk melindungi investasi Anda",0
12,"dana pendidikan anak","Bagaimana cara menyiapkan dana pendidikan anak?","Menyiapkan dana pendidikan anak bisa dilakukan dengan memulai tabungan pendidikan sedini mungkin, memanfaatkan produk tabungan atau investasi yang didedikasikan untuk pendidikan, dan berinvestasi secara berkala dalam instrumen yang dapat mengalahkan inflasi seperti reksa dana atau saham.",0
13,"dana pensiun","Bagaimana cara menyiapkan dana pensiun?","Menyiapkan dana pensiun melibatkan menetapkan tujuan pensiun yang jelas, menghitung jumlah yang dibutuhkan untuk pensiun nyaman, menabung dan berinvestasi secara konsisten dalam rencana pensiun seperti DPLK atau reksa dana pensiun, dan mengelola portofolio investasi Anda secara berkala untuk memastikan pertumbuhan yang optimal.",0
14,"mengatur keuangan untuk melunasi utang","Bagaimana mengatur keuangan untuk melunasi utang dengan gaji lima sampai sepuluh juta?","Dengan gaji 5-10 juta, penting untuk membuat anggaran yang ketat. Prioritaskan pembayaran utang dengan bunga tertinggi, sisihkan sebagian pendapatan untuk tabungan darurat, dan pertimbangkan sumber pendapatan tambahan. Kurangi pengeluaran yang tidak perlu dan gunakan uang ekstra untuk mempercepat pelunasan utang.",0
15,"tips mengelola gaji untuk KPR","Apa langkah-langkah untuk mengelola KPR dengan gaji delapan juta per bulan?","Dengan gaji 8 juta per bulan, buat anggaran yang ketat yang mencakup pembayaran KPR sebagai prioritas utama. Sisihkan dana untuk tabungan darurat dan pastikan untuk membayar cicilan KPR tepat waktu setiap bulan. Jika ada dana tambahan, pertimbangkan untuk melakukan pembayaran tambahan untuk mengurangi total bunga dan mempercepat pelunasan",0
16,"asuransi kesehatan","Bagaimana cara memilih asuransi kesehatan yang tepat?","Untuk memilih asuransi kesehatan yang tepat, pertimbangkan kebutuhan kesehatan Anda dan keluarga. Bandingkan berbagai produk asuransi kesehatan dari beberapa perusahaan asuransi, perhatikan cakupan manfaat, premi yang harus dibayar, dan kebijakan klaim. Pastikan asuransi tersebut mencakup biaya rawat inap, rawat jalan, dan kondisi kesehatan kritis",0
17,"asuransi pendidikan","Apakah asuransi pendidikan penting untuk anak?","Asuransi pendidikan penting karena dapat membantu memastikan bahwa anak Anda memiliki dana yang cukup untuk biaya pendidikan di masa depan. Ini memberikan perlindungan finansial jika terjadi sesuatu yang tidak terduga pada orang tua atau wali yang bertanggung jawab membiayai pendidikan anak. Asuransi pendidikan juga dapat berfungsi sebagai tabungan jangka panjang",0
18,"terjebak utang yang banyak","Bagaimana cara mengatasi masalah keuangan jika sudah terjebak dalam utang yang banyak?","Jika sudah terjebak dalam utang yang banyak, pertama-tama buatlah rencana pelunasan utang yang realistis. Hubungi kreditur untuk menegosiasikan ulang syarat pembayaran atau mencari program restrukturisasi utang. Buat anggaran yang ketat untuk mengurangi pengeluaran dan fokus pada pembayaran utang dengan bunga tertinggi terlebih dahulu. Pertimbangkan mencari sumber pendapatan tambahan untuk membantu mempercepat pelunasan",0
19,"asuransi kesehatan","Apa yang harus dilakukan jika tidak bisa membayar premi asuransi kesehatan?","Jika tidak bisa membayar premi asuransi kesehatan, hubungi perusahaan asuransi untuk mencari solusi, seperti penjadwalan ulang pembayaran premi atau mencari program bantuan. Evaluasi kembali anggaran Anda untuk melihat apakah ada pengeluaran lain yang bisa dikurangi atau dihilangkan untuk membayar premi. Jika situasi keuangan Anda sangat sulit, pertimbangkan mencari produk asuransi dengan premi yang lebih rendah namun tetap memberikan perlindungan dasar",0
20,"rencana keuangan untuk membeli rumah dengan sistem KPR","Bagaimana cara menyusun rencana keuangan untuk membeli rumah dengan KPR?","Untuk menyusun rencana keuangan membeli rumah dengan KPR, pertama-tama hitung jumlah uang muka yang diperlukan dan biaya tambahan lainnya seperti pajak dan biaya notaris. Buat anggaran yang mencakup cicilan KPR bulanan, asuransi properti, dan biaya pemeliharaan. Sisihkan sebagian pendapatan untuk tabungan darurat dan pastikan Anda memiliki pendapatan yang cukup untuk menutupi semua biaya tersebut",0
21,"mengelola keuangan untuk membayar utang dan berinvestasi","Bagaimana cara menyeimbangkan pembayaran utang dan investasi?","Untuk menyeimbangkan pembayaran utang dan investasi, buat anggaran yang mencakup alokasi untuk keduanya. Prioritaskan pembayaran utang dengan bunga tinggi, namun tetap sisihkan sebagian pendapatan untuk investasi, meskipun jumlahnya kecil. Diversifikasi investasi untuk meminimalkan risiko dan pastikan Anda memiliki dana darurat yang cukup sebelum melakukan investasi besar. Jika utang Anda memiliki suku bunga rendah, Anda bisa mempertimbangkan untuk meningkatkan alokasi investasi",0
22,"memanfaatkan kartu kredit secara bijak","Bagaimana cara memanfaatkan kartu kredit secara bijak untuk kebutuhan sehari-hari?","Memanfaatkan kartu kredit secara bijak untuk kebutuhan sehari-hari melibatkan menggunakan kartu kredit hanya untuk pembelian yang bisa Anda bayar penuh setiap bulan. Hindari penggunaan kartu kredit untuk pembelian impulsif atau barang yang tidak diperlukan. Manfaatkan program rewards atau cashback yang ditawarkan oleh kartu kredit. Selalu bayar saldo kartu kredit tepat waktu untuk menghindari bunga dan denda.",0
23,"merencanakan dana pensiun dengan gaji UMR","Bagaimana cara merencanakan dana pensiun dengan gaji tujuh juta per bulan?","Dengan gaji tujuh juta per bulan, mulailah menabung untuk dana pensiun sedini mungkin. Buat anggaran yang menyisihkan sebagian pendapatan setiap bulan untuk tabungan pensiun, seperti dalam reksa dana atau program pensiun lainnya. Pertimbangkan untuk meningkatkan tabungan pensiun seiring dengan peningkatan pendapatan. Diversifikasi investasi pensiun Anda untuk mengurangi risiko dan memastikan pertumbuhan yang stabil.",0
24,"kesulitan membayar cicilan KPR","Apa yang harus dilakukan jika kesulitan membayar cicilan KPR dengan gaji sepuluh juta per bulan?","Jika kesulitan membayar cicilan KPR dengan gaji sepuluh juta per bulan, pertama-tama hubungi bank atau lembaga pembiayaan untuk memberi tahu mereka tentang situasi keuangan Anda. Diskusikan opsi restrukturisasi KPR atau penjadwalan ulang pembayaran yang bisa membantu mengurangi beban pembayaran bulanan.",0
25,"mempersiapkan dana pendidikan anak","Bagaimana cara mempersiapkan dana pendidikan anak dengan gaji tujuh juta per bulan?","Untuk mempersiapkan dana pendidikan anak dengan gaji tujuh juta per bulan, pertama-tama tentukan biaya pendidikan yang diinginkan untuk anak Anda di masa depan. Hitung berapa banyak dana yang perlu Anda tabung setiap bulan untuk mencapai tujuan tersebut. Pertimbangkan untuk membuka rekening tabungan khusus pendidikan atau berinvestasi dalam program pendidikan khusus yang dirancang untuk menabung untuk biaya pendidikan anak.",0
26,"utang pendidikan setelah lulus kuliah","Apa yang harus dilakukan jika memiliki utang pendidikan yang besar setelah lulus perguruan tinggi dengan gaji sembilan juta per bulan?","Jika memiliki utang pendidikan yang besar setelah lulus perguruan tinggi dengan gaji sembilan juta per bulan, pertama-tama buatlah rencana pelunasan yang mencakup pembayaran lebih dari minimum setiap bulan untuk mempercepat pelunasan. Cari program penangguhan atau restrukturisasi utang jika mengalami kesulitan keuangan. Sisihkan dana darurat untuk melindungi diri dari kejadian tak terduga yang bisa mempengaruhi kemampuan Anda untuk membayar utang",0
27,"mengelola utang kartu kredit dengan suku bunga yang tinggi","Bagaimana cara mengelola utang kartu kredit dengan suku bunga tinggi dengan gaji tujuh juta per bulan?,","Untuk mengelola utang kartu kredit dengan suku bunga tinggi dengan gaji tujuh juta per bulan, pertama-tama prioritaskan pembayaran utang kartu kredit tersebut. Buat rencana pembayaran yang mencakup pembayaran lebih dari minimum setiap bulan untuk mempercepat pelunasan. Cari cara untuk menurunkan suku bunga kartu kredit, seperti dengan memindahkan saldo ke kartu dengan suku bunga lebih rendah atau mendapatkan pinjaman konsolidasi utang dengan suku bunga lebih baik.",0
28,"tips mengurangi pengeluaran bulanan dengan gaji UMR","Apa langkah-langkah yang dapat diambil untuk mengurangi pengeluaran bulanan dan meningkatkan tabungan dengan gaji enam juta per bulan?","Untuk mengurangi pengeluaran bulanan dan meningkatkan tabungan dengan gaji enam juta per bulan, pertama-tama identifikasi pengeluaran yang tidak penting dan kurangi atau hilangkan pengeluaran tersebut. Buat anggaran yang ketat untuk memprioritaskan pengeluaran yang benar-benar diperlukan. Cari cara untuk menghemat pada tagihan rutin seperti utilitas dan langganan. Pertimbangkan juga untuk menambah penghasilan tambahan dengan bekerja paruh waktu atau menjalankan bisnis sampingan.",0
29,"menyusun rencana keuangan untuk pensiun dini","Bagaimana cara menyusun rencana keuangan untuk pensiun bagi seseorang dengan gaji sepuluh juta per bulan?","Untuk menyusun rencana keuangan pensiun, pertimbangkan berapa lama lagi Anda akan bekerja dan berapa banyak uang yang ingin Anda miliki saat pensiun. Hitung berapa banyak uang yang perlu Anda tabung setiap bulan untuk mencapai tujuan pensiun Anda. Pilih instrumen investasi yang sesuai dengan profil risiko Anda dan alokasikan dana pensiun secara bijak. Selalu tinjau dan sesuaikan rencana pensiun Anda secara berkala.",0
30,"tips untuk mengelola utang konsumsi","Apa langkah-langkah yang perlu diambil untuk mengelola utang konsumsi dengan gaji delapan juta per bulan?","Dengan gaji delapan juta per bulan, langkah-langkah untuk mengelola utang konsumsi termasuk membuat anggaran yang ketat yang mencakup pembayaran utang sebagai prioritas utama. Identifikasi utang dengan suku bunga tertinggi dan prioritaskan pembayarannya. Sisihkan dana untuk tabungan darurat dan gunakan pendapatan tambahan untuk mempercepat pelunasan utang. Hindari membuat utang baru dan kurangi pengeluaran yang tidak perlu.",0
31,"tips untuk mengelola utang konsumsi","Bagaimana cara mengelola utang konsumtif dengan gaji delapan juta per bulan?","Untuk mengelola utang konsumtif dengan gaji delapan juta per bulan, buat anggaran yang ketat yang memprioritaskan pembayaran utang. Identifikasi utang dengan suku bunga tertinggi dan prioritaskan pembayarannya. Sisihkan sebagian dari gaji Anda untuk pembayaran tambahan utang. Kurangi pengeluaran yang tidak penting dan pertimbangkan sumber penghasilan tambahan untuk mempercepat pelunasan utang. Jangan membuat utang baru sampai utang lama terlunasi",0
32,"utang pendidikan setelah lulus kuliah","Bagaimana cara mengelola utang kuliah setelah lulus dari perguruan tinggi?","Untuk mengelola utang kuliah setelah lulus, pertama-tama identifikasi semua utang yang dimiliki, termasuk jenis utang, jumlah yang harus dibayar, dan suku bunga. Buat rencana pembayaran utang yang mencakup pembayaran minimal setiap bulan dan pembayaran tambahan jika memungkinkan. Cari program keringanan utang atau penjadwalan ulang pembayaran jika mengalami kesulitan keuangan. Selalu prioritaskan pembayaran utang kuliah untuk menghindari bunga dan denda yang lebih besar.",0
33,"memanfaatkan asuransi kesehatan","Bagaimana cara memanfaatkan asuransi kesehatan dengan premi yang terjangkau untuk keluarga dengan gaji delapan juta per bulan?","Untuk memanfaatkan asuransi kesehatan dengan premi yang terjangkau untuk keluarga dengan gaji delapan juta per bulan, pertama-tama bandingkan berbagai produk asuransi kesehatan dari beberapa perusahaan asuransi. Pilihlah produk dengan premi yang sesuai dengan anggaran Anda tetapi tetap memberikan cakupan yang memadai untuk kebutuhan kesehatan keluarga Anda. Pastikan untuk membaca dan memahami semua ketentuan dan batasan dalam polis asuransi.",0
34,"mengelola utang pinjaman KPR","Bagaimana cara mengelola utang pinjaman KPR dengan gaji sembilan juta per bulan?","Untuk mengelola utang pinjaman KPR dengan gaji sembilan juta per bulan, pertama-tama pastikan Anda memiliki anggaran yang mencakup pembayaran KPR sebagai prioritas utama. Sisihkan dana darurat untuk mengantisipasi pengeluaran tak terduga. Cari opsi refinancing jika suku bunga yang ditawarkan lebih rendah dari suku bunga pinjaman Anda saat ini. Pertimbangkan pembayaran tambahan jika memungkinkan untuk mempercepat pelunasan KPR.",0
35,"memulai investasi","Bagaimana cara memulai investasi dengan gaji lima juta per bulan?","Untuk memulai investasi dengan gaji lima juta per bulan, pertama-tama alokasikan sebagian dari pendapatan Anda untuk ditabung setiap bulan. Mulailah dengan jumlah kecil dan tingkatkan seiring waktu. Pilih instrumen investasi yang sesuai dengan toleransi risiko dan tujuan keuangan Anda, seperti reksa dana atau saham dengan modal rendah. Manfaatkan aplikasi investasi online yang memungkinkan Anda berinvestasi dengan mudah dan biaya rendah. Disiplin dalam menyisihkan dana setiap bulan akan membantu Anda membangun portofolio investasi yang benar.",0
36,"manfaat dan risiko investasi obligasi","Apa manfaat dan risiko berinvestasi dalam obligasi pemerintah?","Manfaat berinvestasi dalam obligasi pemerintah termasuk stabilitas dan keamanan, karena obligasi pemerintah dianggap sebagai investasi berisiko rendah. Mereka menawarkan pendapatan tetap melalui pembayaran bunga berkala. Namun, risiko yang perlu dipertimbangkan termasuk inflasi yang dapat mengurangi daya beli bunga yang diterima dan potensi penurunan nilai obligasi jika suku bunga naik. Selain itu, likuiditas mungkin menjadi masalah jika Anda perlu menjual obligasi sebelum jatuh tempo.",0
37,"mempersiapkan dana pensiun melalui investasi","Bagaimana cara mempersiapkan dana pensiun melalui investasi?","Untuk mempersiapkan dana pensiun melalui investasi, pertama-tama tentukan jumlah dana yang Anda butuhkan untuk pensiun yang nyaman. Buat rencana investasi jangka panjang yang mencakup berbagai aset seperti saham, obligasi, dan reksa dana. Manfaatkan akun pensiun yang menawarkan insentif pajak seperti Dana Pensiun Lembaga Keuangan (DPLK) atau produk asuransi dengan investasi. Selalu tinjau dan sesuaikan portofolio Anda sesuai dengan perubahan tujuan keuangan dan kondisi pasar.",0
38,"hal yang perlu dipertimbangkan sebelum investasi cryptocurrency","Apa yang perlu dipertimbangkan sebelum berinvestasi dalam cryptocurrency?","Sebelum berinvestasi dalam cryptocurrency, pertimbangkan volatilitas tinggi dan risiko yang terkait dengan pasar ini. Pelajari tentang teknologi blockchain, jenis-jenis cryptocurrency, dan potensi keuntungan serta kerugiannya. Pastikan Anda memahami risiko keamanan seperti hacking dan pencurian, serta regulasi yang mungkin mempengaruhi nilai cryptocurrency. Jangan menginvestasikan lebih dari yang Anda siap kehilangan dan diversifikasikan portofolio Anda untuk mengurangi risiko.",0
39,"mengelola portofolio investasi yang seimbang","Bagaimana cara mengelola portofolio investasi yang seimbang?","Untuk mengelola portofolio investasi yang seimbang, diversifikasi aset Anda di berbagai jenis investasi seperti saham, obligasi, properti, dan reksa dana. Tentukan alokasi aset berdasarkan tujuan keuangan, jangka waktu investasi, dan toleransi risiko Anda. Tinjau dan sesuaikan portofolio Anda secara berkala untuk memastikan bahwa alokasi aset tetap sesuai dengan tujuan Anda. Pertimbangkan untuk menginvestasikan sebagian dana dalam aset yang lebih stabil seperti obligasi atau properti untuk mengurangi risiko volatilitas pasar saham.",0
40,"yang harus dilakukan jika investasi saham turun","Apa yang harus dilakukan jika investasi saham mengalami penurunan nilai?","Jika investasi saham mengalami penurunan nilai, pertama-tama jangan panik. Evaluasi kembali alasan Anda berinvestasi di saham tersebut dan periksa apakah ada perubahan fundamental dalam perusahaan yang mempengaruhi kinerjanya. Jika penurunan disebabkan oleh faktor pasar jangka pendek, pertimbangkan untuk tetap memegang saham tersebut dan menunggu pemulihan. Namun, jika ada perubahan negatif yang signifikan dalam prospek perusahaan, mungkin perlu mempertimbangkan untuk menjual saham tersebut dan mengalokasikan dana ke investasi yang lebih baik.",0
41,"tips memulai investasi properti dengan modal terbatas","Bagaimana cara memulai investasi properti dengan modal terbatas?","Untuk memulai investasi properti dengan modal terbatas, pertimbangkan untuk berinvestasi dalam properti sewaan skala kecil seperti apartemen atau rumah kos. Anda juga bisa bergabung dengan investasi properti bersama (crowdfunding) di mana beberapa investor mengumpulkan dana untuk membeli properti bersama. Pilihan lain adalah Real Estate Investment Trusts (REITs), yang memungkinkan Anda berinvestasi di portofolio properti tanpa harus membeli properti fisik. Pastikan untuk melakukan riset pasar dan analisis kelayakan sebelum melakukan investasi",0
42,"keuntungan dan risiko investasi reksa dana","Apa keuntungan dan risiko berinvestasi dalam reksa dana?","Keuntungan berinvestasi dalam reksa dana termasuk diversifikasi, manajemen profesional, dan akses mudah ke berbagai aset dengan investasi awal yang relatif kecil. Reksa dana memungkinkan Anda untuk menyebarkan risiko dan mendapatkan potensi imbal hasil yang stabil. Namun, risiko yang perlu dipertimbangkan termasuk biaya manajemen, potensi penurunan nilai investasi, dan kinerja yang mungkin tidak selalu lebih baik daripada investasi individual. Penting untuk membaca prospektus reksa dana dan memahami strategi investasi serta biaya terkait.",0
43,"cara memilih saham yang tepat untuk investasi jangka panjang","Bagaimana cara memilih saham yang tepat untuk investasi jangka panjang?","Untuk memilih saham yang tepat untuk investasi jangka panjang, lakukan analisis fundamental perusahaan. Periksa laporan keuangan, kinerja historis, prospek pertumbuhan, dan posisi kompetitif perusahaan di pasar. Evaluasi rasio keuangan seperti Price to Earnings (P/E) ratio, Price to Book (P/B) ratio, dan Return on Equity (ROE). Selain itu, pertimbangkan faktor-faktor eksternal seperti kondisi ekonomi dan tren industri. Diversifikasi portofolio Anda untuk mengurangi risiko.",0
44,"langkah awal untuk investasi","Apa langkah pertama yang harus saya ambil untuk mulai berinvestasi?","Langkah pertama untuk mulai berinvestasi adalah memahami tujuan keuangan Anda. Tentukan berapa banyak uang yang ingin Anda hasilkan, jangka waktu investasi, dan toleransi risiko Anda. Selanjutnya, pelajari berbagai jenis investasi yang tersedia seperti saham, obligasi, reksa dana, dan properti. Buka akun investasi melalui bank atau platform investasi online, dan mulailah dengan jumlah kecil untuk meminimalkan risiko sambil belajar lebih lanjut.",0
45,"cara berinvestasi dengan gaji UMR untuk mencapai finansial jangka panjang","Bagaimana cara berinvestasi dengan gaji empat juta per bulan untuk mengoptimalkan tabungan dan mencapai tujuan finansial jangka panjang?","Yang pertama, Budgeting dan Menabung: Alokasikan sepuluh sampai duapuluh persen dari gaji untuk tabungan dan investasi. Mulailah dengan sekitar empat ratus hingga delapan ratuh per bulan. Gunakan aplikasi pengelolaan keuangan untuk membantu mengatur pengeluaran. Yang kedua, Investasi Mikro: Mulailah dengan produk investasi yang membutuhkan modal kecil, seperti reksa dana online atau emas digital yang bisa dibeli mulai dari serratus ribu. Manfaatkan platform investasi yang tidak membebankan biaya transaksi tinggi. Yang ketiga, Edukasi Finansial: Manfaatkan sumber daya online gratis seperti webinar, artikel, dan video edukasi tentang investasi. Ikuti komunitas atau forum investasi untuk belajar dari pengalaman orang lain. Yang keempat, Investasi Jangka Panjang: Fokus pada investasi jangka panjang seperti reksa dana saham yang cenderung memberikan imbal hasil lebih baik dalam jangka panjang. Hindari investasi berisiko tinggi dan spekulatif.",0
46,"cara mengalokasikan gaji yang di atas UMR untuk investasi yang optimal","Bagaimana cara mengalokasikan gaji dua belas juta per bulan untuk investasi yang optimal dan diversifikasi portofolio?","Yang pertama, Diversifikasi Investasi: Alokasikan duapuluh sampai tigapuluh persen dari gaji untuk investasi, sekitar dua juta empat ratus hingga tiga juta enam ratus per bulan. Diversifikasikan portofolio dengan berbagai instrumen seperti saham, reksa dana, obligasi, dan properti kecil. Yang kedua, Properti dan Real Estate: Pertimbangkan untuk mulai menabung untuk uang muka properti atau investasi di crowdfunding properti. Investasi di properti bisa menjadi aset jangka panjang yang bernilai. Yang ketiga, Manfaatkan Insentif Pajak: Gunakan produk investasi yang menawarkan insentif pajak seperti Dana Pensiun Lembaga Keuangan (DPLK) atau asuransi unit link. Konsultasikan dengan penasihat pajak untuk mengoptimalkan strategi investasi dan pajak. Yang keempat, Pengelolaan Utang: Prioritaskan pembayaran utang berbunga tinggi seperti kartu kredit untuk mengurangi beban finansial. Gunakan sisa gaji untuk investasi yang lebih produktif.",0
47,"strategi mencapai financial freedom sebelum mencapai usia empat puluh tahun","Bagaimana strategi yang tepat untuk mencapai financial freedom sebelum mencapai usia empat puluh tahun?","Strategi yang tepat untuk mencapai financial freedom sebelum usia 40 tahun meliputi, Membuat rencana keuangan yang jelas dan realistis, Prioritaskan menabung dan berinvestasi secara cerdas sejak usia muda, Kurangi pengeluaran yang tidak perlu dan hindari utang yang tidak produktif, Diversifikasikan portofolio investasi dengan saham, obligasi, properti, dan instrumen investasi lainnya, Konsultasikan dengan ahli keuangan atau finansial planner untuk merancang strategi investasi yang sesuai dengan profil risiko dan tujuan keuangan.",0
