id,context,question,answer,answer_start
48,"tips untuk membangun kekayaan yang efektif untuk mencapai financial freedom sedini mungkin","Apa langkah-langkah praktis yang bisa diambil untuk membangun kekayaan secara efektif dan mencapai financial freedom pada usia muda?","Langkah-langkah praktis untuk membangun kekayaan dan mencapai financial freedom pada usia muda antara lain, Membuat anggaran dan merencanakan pengeluaran serta tabungan dengan disiplin, Manfaatkan peluang investasi yang ada, seperti saham, reksa dana, dan property, Tingkatkan pengetahuan finansial dan hindari utang yang tidak perlu, Perlindungan asuransi untuk mengamankan kekayaan yang sudah dibangun.",0
49,"cara mengatur keuangan untuk mencapai kebebasan finansial/ financial freedom sebelum memasuki usia empat puluh tahun","Bagaimana cara mengatur keuangan agar bisa meraih kebebasan finansial sebelum memasuki usia empat puluh tahun?","Untuk meraih kebebasan finansial sebelum usia empat puluh tahun, Anda perlu, Membuat tujuan finansial yang jelas dan realistis, Melakukan pengaturan anggaran untuk mengontrol pengeluaran, Manfaatkan peluang investasi yang ada, Bayar utang dengan bunga tinggi secepat mungkin, Sediakan dana darurat dan perlindungan asuransi yang sesuai.",0
50,"jenis investasi yang dapat mengamankan finansial masa depan dan mencapai financial freedom pada usia muda","Apa saja investasi yang dapat dilakukan untuk mengamankan finansial masa depan dan mencapai financial freedom pada usia muda?","Beberapa investasi yang dapat dilakukan untuk mengamankan masa depan finansial dan mencapai financial freedom pada usia muda antara lain, Investasi jangka panjang seperti saham dan reksa dana saham, Investasi dalam property, Investasi dalam pendidikan dan pengembangan diri",0
51,"cara mengoptimalkan penghasilan agar bisa mencapai financial freedom/ kebebasan finansial pada usia muda","Bagaimana cara mengoptimalkan penghasilan dan mengelola pengeluaran agar bisa mencapai tujuan financial freedom pada usia empat puluh tahun?","Untuk mengoptimalkan penghasilan dan mengelola pengeluaran guna mencapai tujuan financial freedom pada usia 40 tahun, Anda bisa, Mencari peluang untuk meningkatkan pendapatan, seperti mengembangkan keterampilan atau memulai bisnis sampingan, Membuat anggaran dan mengidentifikasi area pengeluaran yang bisa dikurangi, Tetap konsisten dengan rencana keuangan dan berkonsultasi dengan ahli keuangan jika diperlukan.",0
52,"memulai perencanaan keuangan untuk mencapai financial freedom","Bagaimana cara memulai perencanaan keuangan untuk mencapai financial freedom sedini mungkin?","Untuk memulai perencanaan keuangan guna mencapai financial freedom sedini mungkin, lakukan langkah-langkah berikut, Tentukan tujuan keuangan jangka pendek, menengah, dan Panjang, Buat anggaran bulanan untuk mengatur pengeluaran dan tabungan, Sisihkan minimal dua puluh persen dari pendapatan untuk tabungan dan investasi, Manfaatkan produk investasi yang sesuai dengan profil risiko Anda.",0
53,"kesahalan yang harus dihindari untuk mencapai financial freedom lebih cepat","Apa saja kesalahan yang harus dihindari agar bisa mencapai financial freedom lebih cepat?","Beberapa kesalahan yang harus dihindari untuk mencapai financial freedom lebih cepat meliputi, Tidak memiliki anggaran yang jelas, Mengabaikan pentingnya tabungan darurat, Berinvestasi tanpa pengetahuan yang memadai, Mengabaikan utang dengan bunga tinggi.",0
54,"cara mengelola pendapatan tambahan untuk membantu mencapai financial freedom","Bagaimana cara mengelola pendapatan tambahan agar dapat membantu mencapai financial freedom lebih cepat?","Cara mengelola pendapatan tambahan untuk membantu mencapai financial freedom lebih cepat meliputi, Alokasikan sebagian besar pendapatan tambahan untuk tabungan dan investasi, Gunakan pendapatan tambahan untuk melunasi utang dengan bunga tinggi, Investasikan dalam aset yang memberikan penghasilan pasif.",0
55,"strategi investasi untuk mencapai financial freedom sedini mungkin","Bagaimana strategi investasi yang tepat untuk mencapai financial freedom sedini mungkin?","Strategi investasi yang tepat untuk mencapai financial freedom sedini mungkin meliputi, Diversifikasi portofolio investasi untuk mengurangi risiko, Fokus pada investasi jangka panjang yang memiliki potensi pertumbuhan tinggi, Manfaatkan instrumen investasi seperti saham, reksa dana, dan properti.",0
56,"memastikan perencanaan keuangan","Bagaimana cara memastikan perencanaan keuangan tetap berjalan sesuai rencana untuk mencapai financial freedom?","Untuk memastikan perencanaan keuangan tetap berjalan sesuai rencana, lakukan, Tinjau dan evaluasi rencana keuangan secara berkala, Sesuaikan rencana keuangan dengan perubahan kondisi finansial dan tujuan hidup, Konsultasikan dengan ahli keuangan untuk mendapatkan masukan dan saran.",0
57,"peran teknologi untuk membantu mencapai financial freedom","Bagaimana cara memanfaatkan teknologi untuk membantu mencapai financial freedom lebih cepat?","Cara memanfaatkan teknologi untuk membantu mencapai financial freedom lebih cepat meliputi, Gunakan aplikasi pengelolaan keuangan untuk melacak pengeluaran dan pendapatan, Manfaatkan platform investasi online untuk kemudahan berinvestasi, Gunakan alat otomatisasi tabungan untuk menyisihkan dana secara rutin.",0
58,"peran pendidikan finansial dalam menca[ai financial freedom","Apa peran pendidikan finansial dalam mencapai financial freedom sedini mungkin?","Pendidikan finansial berperan penting dalam mencapai financial freedom dengan, Membantu memahami konsep dasar keuangan seperti anggaran, tabungan, dan investasi, Membekali dengan pengetahuan untuk membuat keputusan finansial yang bijak, Meningkatkan kemampuan untuk mengelola risiko dan merencanakan masa depan keuangan.",0
59,"cara mengatur prioritas keuangan untuk mencapai financial freedom/ kebebasan finansial","Bagaimana cara mengatur ulang prioritas keuangan untuk mencapai financial freedom lebih cepat?","Mengatur ulang prioritas keuangan untuk mencapai financial freedom lebih cepat melibatkan, Fokus pada tujuan keuangan jangka panjang yang penting, Kurangi pengeluaran yang tidak perlu dan alokasikan dana untuk investasi, Prioritaskan pembayaran utang dengan bunga tinggi.","0"
60,"merencanakan dana pensiun","Bagaimana cara merencanakan dana pensiun agar bisa mencapai financial freedom sedini mungkin?","Merencanakan dana pensiun agar bisa mencapai financial freedom sedini mungkin melibatkan, Menentukan jumlah dana pensiun yang dibutuhkan berdasarkan gaya hidup yang diinginkan, Mulai menabung dan berinvestasi untuk dana pensiun sedini mungkin, Manfaatkan produk pensiun seperti dana pensiun atau asuransi pensiun.",0
61,"cara menjaga disiplin dalam mengikuti rencana keuangan","Bagaimana cara menjaga disiplin dalam mengikuti rencana keuangan untuk mencapai financial freedom?","Cara menjaga disiplin dalam mengikuti rencana keuangan meliputi, Buat anggaran yang realistis dan sesuai dengan tujuan keuangan, Pantau dan catat pengeluaran secara rutin, Tetapkan pengingat atau alarm untuk meninjau rencana keuangan secara berkala.",0
62,"cara efektif dalam menyisihkan gaji untuk memulai bisnis","Bagaimana cara efektif menyisihkan gaji untuk memulai bisnis?","Mulailah dengan membuat anggaran bulanan yang mencakup semua kebutuhan dan menyisihkan sebagian dari pendapatan untuk modal bisnis. Idealnya, alokasikan dua puluh sampai tiga puluh persen dari gaji untuk dana bisnis dan simpan di rekening terpisah agar tidak tercampur dengan pengeluaran sehari-hari.",0
63,"langkah awal untuk mengelola utang","Apa langkah pertama dalam mengelola utang agar bisa mencapai financial freedom?","Langkah pertama adalah mengidentifikasi semua utang yang dimiliki, termasuk jumlah, bunga, dan jatuh tempo. Buat rencana pembayaran dengan fokus pada utang dengan bunga tertinggi terlebih dahulu sambil tetap membayar minimum pada utang lainnya.",0
64,"cara mengelola aset ","Bagaimana cara mengelola aset dengan benar untuk mencapai financial freedom?","Kategorikan aset berdasarkan likuiditas dan potensi pertumbuhan. Diversifikasikan investasi ke berbagai jenis aset seperti saham, properti, dan reksa dana untuk mengurangi risiko dan memaksimalkan pertumbuhan.",0
65,"menyusun rencana keuangan untuk jangka panjang","Bagaimana menyusun rencana keuangan untuk jangka panjang?","Mulailah dengan menetapkan tujuan keuangan jangka panjang seperti membeli rumah, pensiun, atau pendidikan anak. Buat anggaran yang mencakup tabungan dan investasi untuk mencapai tujuan tersebut, dan tinjau secara berkala untuk memastikan rencana tetap relevan",0
66,"cara membayar utang kartu kredit secara efektif","Bagaimana cara membayar utang kartu kredit secara efektif?","Prioritaskan pembayaran kartu kredit dengan bunga tertinggi terlebih dahulu. Gunakan strategi pembayaran seperti snowball atau avalanche, dan hindari penggunaan kartu kredit untuk pengeluaran yang tidak penting hingga utang terbayar lunas.",0
67,"strategi investasi yang cocok untuk penghasilan mengenah atau UMR","Apa saja strategi investasi yang cocok untuk penghasilan menengah?","Diversifikasikan investasi ke dalam saham, reksa dana, dan deposito. Pertimbangkan juga untuk berinvestasi dalam properti kecil yang bisa memberikan penghasilan pasif. Pastikan investasi sesuai dengan profil risiko dan tujuan keuangan Anda",0
68,"mengelola gaji untuk menyisihkan dana pensiun","Bagaimana mengelola gaji agar bisa menyisihkan untuk dana pensiun?","Alokasikan setidaknya sepuluh sampai lima belas persen dari gaji bulanan ke rekening pensiun atau produk investasi jangka panjang seperti reksa dana saham. Manfaatkan program pensiun dari perusahaan jika tersedia untuk mendapatkan manfaat tambahan.",0
69,"tips menyusun anggaran untuk kebutuhan sehari-hari dan investasi","Bagaimana cara menyusun anggaran untuk kebutuhan sehari-hari dan investasi?","Buat daftar semua pengeluaran bulanan dan pisahkan antara kebutuhan dan keinginan. Alokasikan minimal dua puluh persen dari gaji untuk tabungan dan investasi. Gunakan sisa gaji untuk kebutuhan sehari-hari, dan jika ada surplus, tambahkan ke tabungan atau investasi.",0
70,"cara mengatur keuangan untuk membeli rumah secara cash","Bagaimana cara mengatur keuangan untuk membeli rumah pertama?","Mulailah dengan menentukan jumlah uang muka yang dibutuhkan dan hitung berapa yang harus ditabung setiap bulan untuk mencapainya. Pertimbangkan juga biaya tambahan seperti pajak, asuransi, dan perawatan. Cari KPR dengan bunga rendah dan cicilan yang sesuai dengan kemampuan finansial.",0
71,"cara memanfaatkan bonus tahunan untuk mencapai financial freedom","Bagaimana cara memanfaatkan bonus tahunan untuk mencapai financial freedom?","Alokasikan bonus tahunan untuk membayar utang, menambah dana darurat, dan berinvestasi. Gunakan sebagian kecil untuk pengeluaran yang diinginkan, tetapi pastikan mayoritas digunakan untuk memperkuat kondisi keuangan jangka panjang",0
72,"pentingnya dana darurat dalam perencanaan keuangan","Apa pentingnya dana darurat dalam perencanaan keuangan?","Dana darurat sangat penting untuk menghadapi situasi tak terduga seperti kehilangan pekerjaan atau biaya medis. Idealnya, simpan tiga sampai enam bulan pengeluaran dalam rekening yang mudah diakses dan tidak terpengaruh oleh fluktuasi pasar.",0
73,"cara menentukan prioritas dalam membayar utan dan menabung","Bagaimana cara menentukan prioritas dalam membayar utang dan menabung?","Prioritaskan pembayaran utang dengan bunga tertinggi terlebih dahulu untuk mengurangi beban bunga. Setelah itu, alokasikan dana untuk menabung dan berinvestasi sesuai dengan tujuan keuangan jangka pendek dan panjang.",0
74,"cara mengelola pengeluaran bulanan dengan gaji terbatas (satu juta sampai 3 juta)","Bagaimana cara mengelola pengeluaran bulanan dengan gaji yang terbatas?","Buat anggaran yang realistis dan pisahkan antara kebutuhan dan keinginan. Gunakan aplikasi pengelolaan keuangan untuk melacak pengeluaran, dan cari cara untuk mengurangi biaya, seperti memasak di rumah dan menggunakan transportasi umum.",0
75,"cara memulai investasi dengan gaji kecil","Bagaimana cara memulai investasi dengan gaji kecil?","Mulailah dengan investasi kecil-kecilan seperti reksa dana atau saham fraksional. Gunakan platform investasi yang memungkinkan setoran kecil dan secara bertahap tingkatkan investasi seiring dengan peningkatan pendapatan",0
76,"cara merencanakan pendidikan anak dengan gaji UMR","Bagaimana cara merencanakan pendidikan anak dengan gaji UMR?","Mulailah menabung sejak dini dalam rekening tabungan pendidikan atau produk investasi yang dikhususkan untuk pendidikan. Alokasikan sebagian dari gaji bulanan untuk tabungan ini dan manfaatkan program beasiswa atau dana pendidikan pemerintah jika tersedia.",0
77,"cara memilih asuransi kesehatan yang tepat","Bagaimana cara memilih asuransi kesehatan yang tepat?","Pilih asuransi kesehatan yang sesuai dengan kebutuhan dan anggaran. Bandingkan beberapa produk asuransi, perhatikan cakupan manfaat, premi, dan jaringan rumah sakit. Pastikan asuransi tersebut memberikan perlindungan yang cukup untuk seluruh anggota keluarga.",0
78,"cara memanfaatkan kartu kredit dengan bijak","Bagaimana cara memanfaatkan kartu kredit dengan bijak?","Gunakan kartu kredit hanya untuk pengeluaran yang dapat Anda bayar penuh setiap bulan untuk menghindari bunga. Manfaatkan poin reward atau cashback, dan hindari menggunakan kartu kredit untuk pengeluaran yang tidak perlu.",0
79,"cara merencanakan dana pensiun dengan gaji tinggi atau gaji di atas 2 kali UMR","Bagaimana cara merencanakan dana pensiun dengan gaji tinggi?","Maksimalkan kontribusi ke program pensiun perusahaan atau individu. Diversifikasikan investasi ke aset yang berpotensi memberikan pertumbuhan tinggi seperti saham dan properti. Tinjau dan sesuaikan rencana pensiun secara berkala.",0
80,"cara mengelola gaji untuk berinvestasi dalam properti","Bagaimana cara mengelola gaji agar bisa berinvestasi dalam properti?","Sisihkan sebagian gaji setiap bulan untuk tabungan uang muka. Pertimbangkan properti yang sesuai dengan anggaran dan lokasi yang berpotensi untuk apresiasi nilai. Manfaatkan KPR dengan bunga rendah dan perhatikan biaya tambahan seperti perawatan dan pajak.",0
81,"cara mengelola pendapatan dari hasil bisnis sampingan untuk mencapai financial freedom","Bagaimana cara mengelola pendapatan dari bisnis sampingan untuk mencapai financial freedom?","Pisahkan pendapatan bisnis sampingan dari pengeluaran pribadi. Alokasikan sebagian pendapatan untuk reinvestasi dalam bisnis, sebagian untuk tabungan dan investasi pribadi, dan gunakan sisanya untuk kebutuhan sehari-hari",0
82,"cara melunasi utang KPR lebih cepat","Bagaimana cara melunasi utang KPR lebih cepat?","Bayar lebih dari jumlah minimum setiap bulan atau lakukan pembayaran tambahan secara berkala. Pertimbangkan refinancing jika suku bunga turun untuk mengurangi beban bunga. Manfaatkan bonus atau pendapatan tambahan untuk pembayaran utang.",0
83,"cara mempersiapkan dana pendidikan anak sampai kuliah dengan gaji UMR","Bagaimana cara mempersiapkan dana pendidikan anak sampai kuliah dengan gaji kecil?","Mulailah menabung sejak dini dalam rekening tabungan pendidikan atau investasi berisiko rendah seperti reksa dana pasar uang. Manfaatkan program beasiswa dan bantuan pendidikan pemerintah untuk meringankan biaya.",0
84,"cara memilih investasi yang sesuai dengan kondisi keuangan atau profil risiko","Bagaimana cara memilih investasi yang sesuai dengan profil risiko?","Tentukan profil risiko Anda berdasarkan usia, tujuan keuangan, dan toleransi terhadap fluktuasi pasar. Pilih investasi yang sesuai, seperti saham untuk profil risiko tinggi dan obligasi atau reksa dana pasar uang untuk profil risiko rendah.",0
85,"cara mengelola gaji agar bisa berinvestasi delam saham","Bagaimana cara mengelola gaji agar bisa berinvestasi dalam saham?","Sisihkan sebagian gaji setiap bulan untuk investasi saham. Gunakan platform investasi yang memungkinkan setoran kecil dan diversifikasikan portofolio untuk mengurangi risiko. Lakukan riset dan pilih saham yang memiliki potensi pertumbuhan jangka panjang.",0
86,"cara mengatur gaji yang di bawah UMR untuk membayar utang","Bagaimana cara mengatur keuangan untuk membayar utang dengan gaji kecil?","Buat anggaran ketat yang memprioritaskan pembayaran utang. Gunakan strategi snowball atau avalanche untuk melunasi utang secara bertahap. Kurangi pengeluaran tidak penting dan cari sumber pendapatan tambahan jika memungkinkan.",0
87,"cara memilih reksa dana yang tepat untuk investasi","Bagaimana cara memilih reksa dana yang tepat untuk investasi?","Pilih reksa dana yang sesuai dengan tujuan keuangan dan profil risiko. Bandingkan kinerja historis, biaya pengelolaan, dan kebijakan investasi. Konsultasikan dengan ahli keuangan jika perlu untuk mendapatkan rekomendasi yang tepat.",0
88,"cara mengelola keuangan agar bisa menabung untuk dana darurat","Bagaimana cara mengelola keuangan agar bisa menabung untuk dana darurat?","Alokasikan sebagian dari gaji bulanan ke rekening tabungan khusus dana darurat. Prioritaskan pengeluaran yang penting dan kurangi biaya yang tidak perlu. Tinjau anggaran secara berkala untuk memastikan dana darurat tetap bertambah.",0
89,"cara memanfaatkan teknoogi untuk pengelolaan keuangan","Bagaimana cara memanfaatkan teknologi untuk pengelolaan keuangan yang lebih baik?","Gunakan aplikasi pengelolaan keuangan untuk melacak pengeluaran dan pendapatan. Manfaatkan platform investasi online untuk kemudahan berinvestasi. Gunakan alat otomatisasi tabungan untuk menyisihkan dana secara rutin",0
90,"cara merencanakan keuangan untuk pensiun dengan gaji UMR","Bagaimana cara merencanakan keuangan untuk pensiun dengan gaji sedang atau UMR?","Alokasikan sebagian gaji setiap bulan ke rekening pensiun atau produk investasi jangka panjang. Diversifikasikan portofolio investasi untuk mengurangi risiko dan meningkatkan pertumbuhan. Tinjau dan sesuaikan rencana pensiun secara berkala.",0
91,"cara mengoptimalkan penghasilan agar bisa mencapai financial freedom/ kebebasan finansial lebih cepat","Bagaimana cara mengoptimalkan penghasilan untuk mencapai financial freedom lebih cepat?","Cari sumber pendapatan tambahan seperti pekerjaan sampingan atau investasi yang memberikan penghasilan pasif. Kurangi pengeluaran tidak penting dan alokasikan lebih banyak dana untuk tabungan dan investasi",0
92,"cara membuat aggaran bulanan","Bagaimana cara membuat anggaran bulanan?","Cara membuat anggaran bulanan adalah dengan mencatat semua sumber pendapatan dan mengkategorikan semua pengeluaran menjadi kebutuhan dan keinginan. Prioritaskan kebutuhan seperti makanan, tempat tinggal, dan transportasi, dan sisihkan sebagian pendapatan untuk tabungan dan investasi.",0
93,"perbedaan antara utang baik dan utang buruk","Apa perbedaan antara utang baik dan utang buruk?","Utang baik adalah utang yang digunakan untuk membeli aset yang nilainya bisa meningkat atau menghasilkan pendapatan, seperti pinjaman untuk pendidikan atau hipotek rumah. Utang buruk adalah utang yang digunakan untuk membeli barang konsumtif yang nilainya menurun seiring waktu, seperti kartu kredit yang digunakan untuk belanja barang mewah",0
94,"cara meningkatkan passive income","Bagaimana cara meningkatkan passive income?","Cara meningkatkan passive income termasuk berinvestasi dalam properti sewa, membeli saham yang membayar dividen, menciptakan produk digital seperti e-book atau kursus online, atau menempatkan uang dalam akun tabungan dengan bunga tinggi",0
95,"cara mengelola aset agar lebih produktif","Bagaimana cara mengelola aset agar tetap produktif?","Evaluasi aset secara berkala untuk memastikan mereka memberikan return yang optimal. Diversifikasikan aset ke berbagai kelas seperti saham, obligasi, dan properti untuk mengurangi risiko. Pertimbangkan untuk menjual aset yang kurang produktif dan mengalokasikan dana ke investasi yang lebih menguntungkan.",0
96,"cara menentukan alokasi aset yang tepat","Bagaimana cara menentukan alokasi aset yang tepat?","Tentukan alokasi aset berdasarkan tujuan keuangan, profil risiko, dan jangka waktu investasi. Misalnya, alokasikan lebih banyak ke saham jika memiliki toleransi risiko tinggi dan jangka waktu panjang. Sebaliknya, pilih obligasi atau reksa dana pasar uang untuk tujuan jangka pendek dan risiko rendah",0
97,"cara mengelola properti sebagai aset investasi","Bagaimana cara mengelola properti sebagai aset investasi?","Pastikan properti selalu dalam kondisi baik dengan melakukan perawatan rutin. Sewakan properti untuk mendapatkan penghasilan pasif, dan gunakan pendapatan sewa untuk membayar hipotek atau biaya perawatan. Pertimbangkan lokasi yang strategis dan potensi kenaikan nilai properti saat memilih investasi properti.",0
98,"cara menilai risiko dari suatu investasi","Bagaimana cara menilai risiko dan potensi return dari suatu investasi?","Lakukan analisis mendalam terhadap aset investasi, termasuk kinerja historis, kondisi pasar, dan faktor ekonomi yang mempengaruhi. Gunakan rasio seperti ROI (Return on Investment) dan rasio risiko untuk mengukur potensi keuntungan dan risiko. Konsultasikan dengan ahli keuangan jika perlu untuk mendapatkan pandangan yang lebih komprehensif.",0
99,"cara mengatur keuangan sebagai bagian dari sandwich generation","Bagaimana cara mengatur keuangan sebagai bagian dari sandwich generation?","Prioritaskan pembuatan anggaran yang ketat dengan menyisihkan dana untuk kebutuhan sehari-hari, tabungan darurat, dan investasi. Evaluasi pengeluaran yang bisa dikurangi atau dihilangkan, dan cari sumber pendapatan tambahan jika memungkinkan. Jangan lupa untuk menyisihkan dana untuk biaya perawatan orang tua dan kebutuhan anak.",0
100,"langkah awal untuk mencapai financial freedom bagi sandwich generation","Apa langkah pertama untuk mencapai financial freedom bagi sandwich generation?","Langkah pertama adalah membuat rencana keuangan yang jelas dan realistis. Mulailah dengan mengidentifikasi semua sumber pendapatan dan pengeluaran. Tentukan tujuan keuangan jangka pendek dan jangka panjang, serta alokasikan dana untuk tabungan dan investasi secara konsisten.",0
101,"cara pengelola keuangan untuk pendidikan anak dan perawatan orang tua ","Bagaimana cara menyeimbangkan antara menabung untuk pendidikan anak dan perawatan orang tua?","Buatlah prioritas berdasarkan urgensi dan kebutuhan saat ini. Misalnya, jika pendidikan anak lebih mendesak, alokasikan lebih banyak dana ke sana sementara tetap menyisihkan sebagian untuk perawatan orang tua. Manfaatkan program tabungan pendidikan dan asuransi kesehatan untuk membantu mengelola biaya",0
102,"strategi investasi yang tepat bagi sandwich generation","Apa strategi investasi yang tepat bagi sandwich generation?","Pilihlah investasi yang menawarkan keseimbangan antara risiko dan pengembalian. Diversifikasikan portofolio ke dalam saham, obligasi, reksa dana, dan properti untuk mengurangi risiko. Pertimbangkan investasi jangka panjang seperti reksa dana atau saham blue-chip yang cenderung stabil dan memberikan return yang baik.",0
103,"cara mengelola utang orang tua sebagai sandwich generation","Bagaimana cara mengelola utang orang tua  sebagai sandwich generation untuk mencapai financial freedom?","Buatlah rencana pembayaran utang yang terstruktur dengan fokus pada melunasi utang berbunga tinggi terlebih dahulu. Pertimbangkan konsolidasi utang untuk mendapatkan suku bunga yang lebih rendah. Tetap disiplin dalam menghindari utang baru dan alokasikan sebagian pendapatan untuk tabungan dan investasi.",0
104,"pentingnya memiliki asuransi bagi sandwich generation","Apa pentingnya memiliki asuransi bagi sandwich generation?","Asuransi sangat penting untuk melindungi diri dari risiko finansial yang tidak terduga. Pertimbangkan asuransi kesehatan, jiwa, dan asuransi pendidikan untuk melindungi keluarga dari beban biaya besar yang bisa menguras tabungan dan investasi. Asuransi membantu memastikan stabilitas keuangan jangka panjang",0
105,"cara menyisihkan dana darurat bagi sandwich generation","Bagaimana cara menyisihkan dana darurat bagi sandwich generation?","Tetapkan tujuan dana darurat yang setara dengan tiga sampai enam bulan pengeluaran rutin. Sisihkan sebagian pendapatan setiap bulan secara konsisten ke rekening tabungan khusus dana darurat. Hindari menggunakan dana ini kecuali dalam keadaan darurat yang sebenarnya",0
106,"perencanaan jangka panjang dalam mencapai financial freedom bagi sandwich generation","Apa peran perencanaan jangka panjang dalam mencapai financial freedom bagi sandwich generation?","Perencanaan jangka panjang membantu dalam menetapkan tujuan keuangan yang jelas dan langkah-langkah untuk mencapainya. Ini mencakup investasi, tabungan untuk pensiun, dan strategi pembayaran utang. Perencanaan yang matang membantu memprioritaskan pengeluaran dan memaksimalkan pendapatan untuk mencapai financial freedom",0
107,"cara mengelola pengeluaran sehari-hari bagi sandwich generation","Bagaimana cara mengelola pengeluaran sehari-hari sebagai sandwich generation?","Buatlah anggaran bulanan yang mencakup semua pengeluaran rutin dan non-rutin. Tinjau dan sesuaikan anggaran secara berkala untuk memastikan pengeluaran tidak melebihi pendapatan. Gunakan aplikasi pengelolaan keuangan untuk melacak pengeluaran dan menemukan area di mana penghematan bisa dilakukan.",0
108,"tips untuk meningkatkan penghasilan bagi sandwich generation","Apa langkah praktis untuk meningkatkan penghasilan bagi sandwich generation?","Cari peluang kerja sampingan atau freelance yang bisa dilakukan di waktu luang. Tingkatkan keterampilan dan pendidikan untuk mendapatkan peluang karir yang lebih baik dan gaji yang lebih tinggi. Manfaatkan aset yang dimiliki, seperti menyewakan properti atau menjual barang yang tidak digunakan, untuk menambah pendapatan.",0
