Question,Category
Bagaimana cara memilih reksadana dengan biaya rendah?,Reksadana
Apa itu obligasi euro dan bagaimana cara kerjanya?,Obligasi
Bagaimana cara melakukan analisis sektor dalam investasi saham?,Saham
Apa itu emas Antam dan bagaimana cara membelinya?,Emas
Bagaimana cara menghindari scam dalam investasi cryptocurrency?,Cryptocurrency
Apa saja langkah-langkah dalam membuat anggaran bulanan?,Manajemen keuangan pribadi
Bagaimana cara mendapatkan premi asuransi yang lebih rendah?,Asuransi
Bagaimana kebijakan moneter mempengaruhi inflasi?,Makro ekonomi
Apa saja jenis pengurangan pajak yang tersedia?,Pajak
